title,summary,link,matched_keywords,ingested_at,image_url
The Kicks You Wear: The Hard Part for NikeSkims Begins Now,"NikeSkims feels like a sure thing, but the two brands still have a lot to prove when it comes to their new partnership.",https://www.businessoffashion.com/briefings/sports/the-kicks-you-wear-the-hard-part-for-nikeskims-begins-now/,"new, thing",2025-09-26T11:52:36.221888+00:00,https://img.businessoffashion.com/resizer/v2/4I2ORAV575DEDJISVUJPEX6LYU.png?auth=a9cece7925422742c920a38b6b61e37a5e47dbc8c9e3537e4d998d9a35660816&smart=true&width=1800&height=1013
What Is Armani Group Worth? It’s Complicated,"Giorgio Armani’s will stipulated that 15 percent of the company he founded must be sold by early 2027, but putting a price tag on the group is an inexact science.",https://www.businessoffashion.com/articles/luxury/what-is-armani-worth-its-complicated/,,2025-09-26T11:52:36.221979+00:00,https://img.businessoffashion.com/resizer/v2/V5HPZCJOPFDUTGSQ4XV7EIXKU4.png?auth=4a9a60d6a0e4858e129b0dce20a371ee231ade6e5d753ed227ae0f025cbb3794&smart=true&width=1800&height=1013
"Google, Flo Health to Pay $56 Million in Privacy Violation Suit",Google and period-tracking app Flo Health will pay $56 million to settle a class action claiming they violated the privacy of millions of Flo app users by collecting information about their menstrual health cycles and using it for targeted advertising.,https://www.businessoffashion.com/news/beauty/google-flo-health-privacy-violation-suit/,,2025-09-26T11:52:36.222043+00:00,https://img.businessoffashion.com/resizer/v2/AJYNEZRTKVEI7O52YWTOBPQM44.png?auth=2e41de4d87d91cc0d4c86f3f35d2ad30f466196c74abb284853acbabd7fe4c35&smart=true&width=1800&height=1013
How Good Earth Is Sharing India’s Design and Craft Legacy With the World,"As the boutique lifestyle brand prepares to open its first flagship store outside of India, BoF sits down with founder and creative director Anita Lal to unpack how she unites traditional Indian artistry with contemporary homeware — while celebrating the communities behind the craft.",https://www.businessoffashion.com/articles/global-markets/good-earth-homeware-design-brand-creative-director-anita-lal-builds-global-future-indian-craft/,style,2025-09-26T11:52:36.222098+00:00,https://img.businessoffashion.com/resizer/v2/4WDC6WJGTJHHLIHU6LZEQFT2P4.png?auth=1fbeb653e1f249eb9ca52fc85250965d69456a04ceeb10e72f95eec224051439&smart=true&width=1800&height=1013
Decoding Dubai Fashion Consumer Insights,"Chalhoub Group’s Jasmina Banda, Dubai Design District’s Reem AlAboodi and BoF’s Rawan Maki and Sophie Soar unpacked consumer trends and behaviour in the UAE city, sharing actionable insights for global and regional brands looking to resonate with Dubai’s consumer base today.",https://www.businessoffashion.com/events/global-markets/bof-live-decoding-dubai-fashion-consumer-insights/,"trend, consumer, behaviour, fashion, trend",2025-09-26T11:52:36.222155+00:00,https://img.businessoffashion.com/resizer/v2/HOFBMFZKEJDZ7OFTQS3XQL2DTA.jpg?auth=6e187375bc9d09bd2857854bbe85988780e57c0951a9f54c7c552afec53ab326&smart=true&width=1800&height=1013
Exclusive: The Inside Story of Carhartt WIP’s Fashion Ascent,"In his first interview since taking over as CEO, Wilfried Atzert opens up about his rise from the shop floor to the top job, and his plans to grow the brand without losing its underground credibility.",https://www.businessoffashion.com/articles/professional/exclusive-how-carhartt-made-workwear-fashionable-or-inside-carhartt-wips-quiet-streetwear-takeover/,fashion,2025-09-26T11:52:36.222207+00:00,https://img.businessoffashion.com/resizer/v2/LNX3FMMY45CZVMBYYCPU7JLCUY.jpg?auth=8bbcc01c5a2243f5b14bced115bd645ef0138b056ee78a7c2edc4380547fb8b1&smart=true&width=4088&height=2299
Why Can’t the Art World Make E-Commerce Work?,"Digital sales will never rule the art market’s upper tier, but there’s still scope for selling art merch, multiples and five-figure emerging artists online, argues Marc Spiegler.",https://www.businessoffashion.com/articles/luxury/why-cant-the-art-world-make-e-commerce-work/,,2025-09-26T11:52:36.222258+00:00,https://img.businessoffashion.com/resizer/v2/BMNOVNBAVVFXHITSLQJ2NHUYL4.png?auth=00b434b013237d8229aea61b42435408db14f51ccad27a12c9608cb41d797168&smart=true&width=1800&height=1013
Milan Day Three: Self-Examination,"At Prada, Moschino and more, designers grappled with their own identities on the third day of Milan Fashion Week, writes Angelo Flaccavento.",https://www.businessoffashion.com/reviews/fashion-week/milan-day-three-self-examination/,"fashion, designer",2025-09-26T11:52:36.222302+00:00,https://img.businessoffashion.com/resizer/v2/WMC3YYZERFARLLBFS5CZFDFE7U.jpg?auth=415866d04ec9a87b1ce78e44fc45982d650333a37cdb706ec5c3590b6e0e54b3&smart=true&width=1800&height=1013
Trump Signs TikTok Order With US App Valued at $14 Billion,"‘I had a very good talk with President Xi,’ Trump told reporters in the Oval Office of the White House.",https://www.businessoffashion.com/articles/media/trump-signs-tiktok-order-with-us-app-valued-at-14-billion/,,2025-09-26T11:52:36.222341+00:00,https://img.businessoffashion.com/resizer/v2/CPW56OQQBBGTTCSZLPTCP4NQCQ.jpg?auth=93d7d7385adc8274b07ef50b5118565119c0048f94cfd71ed88bd7adb24ab5a9&smart=true&width=7812&height=5072
Meta Set to Face EU Finding It Failed to Police Illegal Posts,"The European Commission is preparing to issue preliminary findings saying that Meta’s Facebook and Instagram lack an adequate ‘notice and action mechanism’ that would let users flag illegal posts for removal, Bloomberg reported.",https://www.businessoffashion.com/news/media/meta-set-to-face-eu-finding-it-failed-to-police-illegal-posts/,,2025-09-26T11:52:36.222379+00:00,https://img.businessoffashion.com/resizer/v2/QF6E47FOQZGR7HGIRXLVCIXO5A.jpg?auth=72947d86cad8dacc22c67ed504ac93e13c631ed7fffc13e2fd976ff123ec84e3&smart=true&width=1800&height=1013
Amazon to Pay $2.5 Billion to Settle FTC Lawsuit Over Prime ‘Subscription Traps’,The e-commerce giant is also facing a separate case brought by the FTC that the company built and maintained an illegal monopoly.,https://www.businessoffashion.com/news/retail/amazon-to-pay-25-billion-to-settle-ftc-lawsuit-over-prime-subscription-traps/,,2025-09-26T11:52:36.222427+00:00,https://img.businessoffashion.com/resizer/v2/DFSUF5ZEKRFGZGEADVWGETYHL4.jpg?auth=2aad105555f71697e7be8f1581a09caed79863598eeef2deffad996c135a9e4f&smart=true&width=1800&height=1013
"Natalie Massenet, Erik Torstensson Withdraw Lawsuits Against One Another","The Net-a-Porter founder on Wednesday filed a dismissal of the bombshell lawsuit she filed against her former partner, and Frame denim co-founder, in August.",https://www.businessoffashion.com/news/creative-class/natalie-massenet-withdraws-lawsuit-against-erik-torstensson/,,2025-09-26T11:52:36.222468+00:00,https://img.businessoffashion.com/resizer/v2/ADIIR2CIY5GALDWTMKUULACIQI.jpg?auth=3ac8388763052e34433a7785128c62d1da8060c972d7bca76a4e234c040f1714&smart=true&width=1796&height=1011
"L’Oréal Names New Americas CEO, Appoints Chairman","Alexis Perakis-Valat, currently president of its consumer products division, will accede to the role, replacing David Greenberg who will become the company’s US chairman.",https://www.businessoffashion.com/news/beauty/loreal-new-ceo-america/,"new, consumer",2025-09-26T11:52:36.222508+00:00,https://img.businessoffashion.com/resizer/v2/OC6TH72QUBACPII6ZVCTW3EDIY.jpg?auth=8cd02ff91a26b296262d744be017ec11e6b7ef5c8cf1aa3feecd7e2789eb5dc4&smart=true&width=3500&height=1966
"Black, Creative and Collaborating Across Generations","From Virgil Abloh and Edward Buchanan to Karen Binns and Bianca Saunders, Black fashion creatives are forging more intergenerational partnerships.",https://www.businessoffashion.com/opinions/workplace-talent/black-creative-and-collaborating-across-generations/,fashion,2025-09-26T11:52:36.222552+00:00,https://img.businessoffashion.com/resizer/v2/Z4U4XVG3RVDL7NPQDPJ5AOCH2U.jpg?auth=4f0aaeb5645aa98c70e7637a8a7bd65e8db8740707f9c83a4933cf14a3345d92&smart=true&width=2145&height=3347
Fashion’s Progress on Disclosing Emissions Is Stalling,"Advocacy group Fashion Revolution’s second “What Fuels Fashion?” report shows the industry’s continued failure to disclose climate efforts, especially on the critical risks of fossil-fuel based heat stress.",https://www.businessoffashion.com/news/sustainability/fashion-revolution-brands-lack-transparency-on-climate-efforts-heat-stress-on-workers/,"climate, fashion",2025-09-26T11:52:36.222590+00:00,https://img.businessoffashion.com/resizer/v2/EKJITYOJORBZPKBXAVTSTPQR6E.jpg?auth=b55976724957ceb795231afec43700c7cf2b30faaf53ff16bdd5d8c557030fe2&smart=true&width=1800&height=1013
Brunello Cucinelli Shares Fall 15% After Alleged Russia Links,Short seller Morpheus Research accused the Italian luxury label of secretly operating in Russia despite EU sanctions. The company has denied the claims.,https://www.businessoffashion.com/news/luxury/brunello-cucinelli-shares-fall-as-short-seller-makes-russia-claims/,,2025-09-26T11:52:36.222633+00:00,https://img.businessoffashion.com/resizer/v2/QPHFQ6OTBNF4ZKB4PGBFIVLU5Q.jpeg?auth=f5d8949afa025e7e617ee02e3d88dfd35180769a536ef51fd1a35a2d15d4a743&smart=true&width=3500&height=2258
"Full Coverage: Inside the Foundation Wars, Nykaa Lands Deepika Padukone, Bobbi Brown Tells All","This week, I go deep on makeup and the global retail wars.",https://www.businessoffashion.com/articles/beauty/full-coverage-inside-the-foundation-wars-nykaa-lands-deepika-padukone-bobbi-brown-tells-all/,,2025-09-26T11:52:36.222673+00:00,https://img.businessoffashion.com/resizer/v2/VGUCV3GSRNAVTNBG66EXKQVSDY.jpg?auth=12ced208610bec39a2e2c0e2a47f6f62b3b53b2a549f7dfec8faf79f4d1a14f2&smart=true&width=5784&height=4338
Tiffany Godoy to Step Down as Head of Editorial Content at Vogue Japan,Condé Nast Japan president Juna Kitada will also be stepping down at the end of the year.,https://www.businessoffashion.com/news/media/tiffany-godoy-to-step-down-as-head-of-editorial-content-at-vogue-japan/,,2025-09-26T11:52:36.222708+00:00,https://img.businessoffashion.com/resizer/v2/KBSWGRXRNZG2XHPSUGO7BLTX6E.jpg?auth=f93b938aafa6cac3419759d546548e9a29aff012b9838c7f7cbb916f219cc55f&smart=true&width=1800&height=1013
"LVMH Bets on South Korea to Spur Growth on US, China Uncertainty","Louis Vuitton and Christian Dior are both looking to expand their flagship maison-style stores in Seoul’s Cheongdam district within the next few years, Bloomberg reported.",https://www.businessoffashion.com/news/luxury/lvmh-bets-on-south-korea-to-spur-growth-on-us-china-uncertainty/,"next, style",2025-09-26T11:52:36.222745+00:00,https://img.businessoffashion.com/resizer/v2/V62EPVC2FRGWPCAY5EVGKQZXLY.jpg?auth=ac974b79220de9baf56d31c2dd121448fd6eaf53d05b6531fe429cbfd123b619&smart=true&width=1800&height=1013
H&M Group’s Q3 Profits Top Expectations As It Warns of Tariff Costs,H&M reported a higher-than-expected third-quarter profit due to strong autumn sales but warned of increased tariff-related costs and higher markdowns in the current quarter.,https://www.businessoffashion.com/news/retail/hm-groups-q3-profits-top-expectations-as-it-warns-of-tariff-costs/,,2025-09-26T11:52:36.222796+00:00,https://img.businessoffashion.com/resizer/v2/2OYNUFGUGFGE5AIVYPM6VFVZLY.png?auth=2734c7b3990ffae40a74061836096dfca1dfbfc6825b7a73effa116dfa92c19a&smart=true&width=1800&height=1013
Mytheresa Sustains Profitable Growth Amid YNAP Merger,"The German e-tailer’s net sales grew 12 percent in the final quarter of its fiscal 2025, but its newly acquired Net-a-Porter and Mr Porter saw continued declines during the same period.",https://www.businessoffashion.com/news/luxury/mytheresa-continues-profitable-growth/,new,2025-09-26T11:52:36.222840+00:00,https://img.businessoffashion.com/resizer/v2/G5VBVC5N25G45HLIWULVWQBWA4.jpg?auth=f1b20026f7a774403f8b76992bd62529ce88b8bdc5d8b8d86bf3c1efc4fb6b6b&smart=true&width=1800&height=1013
UK Sees Surge in Male Facelifts,"Growing numbers of men and younger people are getting facelifts, a trend driven by social media, surgical innovations and weight loss drugs, according to the British Association of Aesthetic Plastic Surgeons.",https://www.businessoffashion.com/news/beauty/male-facelifts-surge-in-uk/,"trend, innovation, trend",2025-09-26T11:52:36.222881+00:00,https://img.businessoffashion.com/resizer/v2/EQVOTM5KHVAWDABKO7UZM24JNY.jpg?auth=97ce1362d2dd2eeba1b36496c7aeb721da524e3e9e3ed4b364d4b3dc8789f6b7&smart=true&width=1800&height=1013
Revision Skincare Appoints CEO,"Lisa Paley, formerly of health and consumer goods giant Haleon, will power the company’s next phase of growth with a focus on innovation and expansion.",https://www.businessoffashion.com/news/beauty/lisa-paley-revision-skincare-ceo/,"next, innovation, consumer",2025-09-26T11:52:36.222922+00:00,https://img.businessoffashion.com/resizer/v2/BPMNUQWD2VCKJC523WZHZMXSIM.jpg?auth=762f31cec5402a2fac52a43008ce16fd0a62641ffb7d1b35ad9e5d77727b5728&smart=true&width=1800&height=900
Eli Lilly Will Bring Experimental Weight-Loss Pill to India,"The US pharmaceutical giant plans to launch its experimental oral weight-loss drug orforglipron in India, a senior executive told Reuters, offering an alternative to injectables that many patients in the world’s most populous nation resist.",https://www.businessoffashion.com/news/beauty/eli-lilly-bring-weight-loss-pill-to-india/,,2025-09-26T11:52:36.222961+00:00,https://img.businessoffashion.com/resizer/v2/6U6RG2XBGZFVHBI3ETL2LYMR6A.jpg?auth=8d8e80c12e2b004e65ccb84eeb945e4878c3401a5334f389bc4bd3dcb80e7252&smart=true&width=1800&height=1013
A Quietly Powerful New Voice at Jil Sander,"Simone Bellotti beautifully captures the essence of fashion’s ultimate purist, writes Tim Blanks.",https://www.businessoffashion.com/reviews/fashion-week/a-quietly-powerful-new-voice-at-jil-sander/,"new, fashion",2025-09-26T11:52:36.223004+00:00,https://img.businessoffashion.com/resizer/v2/MXAUKVLNNVB3RBXX4Y53KMO4BM.png?auth=f1cd643ad9e63e85d6b3d087b174d799ebb5a87ed44c173996a43384b9d2d162&smart=true&width=1200&height=1800
Maison Kitsuné Appoints Abigail Smith as New Creative Director,"Maison Kitsuné has appointed British designer Abigail Smith as the brand's new creative director, with her first collection for the brand debuting at Paris Fashion Week.",https://www.businessoffashion.com/news/stores/maison-kitsune-paris-fashion-week-creative-director/,"Paris Fashion Week, new, big, fashion, collection, designer",2025-09-26T11:52:36.223040+00:00,https://img.businessoffashion.com/resizer/v2/ZR2CCPHVPJFARCQ3LIHHNONWNY.jpg?auth=b25de91f43909ca4e106bc0e358894f09e122ffb9a6cc60a4bddbc5095e89401&smart=true&width=3553&height=4736
"Birkenstock Lifts Sales Outlook, Buys Factory to Make More Clogs","The footwear brand raised its sales forecast and announced plans for a new factory near Dresden to increase production, as it continues to see strong demand for its footwear.",https://www.businessoffashion.com/news/retail/birkenstock-lifts-sales-outlook-buys-factory-to-make-more-clogs/,"new, announced",2025-09-26T11:52:36.223082+00:00,https://img.businessoffashion.com/resizer/v2/6TSCVESU3VHJHPUNYBZKTAOWFQ.jpg?auth=71ee41f987eff00ec173ec9d05fde9b94b17352184af9634ae131ecfb951761c&smart=true&width=1800&height=1013
Nykaa Names Deepika Padukone Global Ambassador,"The Bollywood actress and luxury brand collaborator has been tapped as the face of the Indian retailer’s beauty business, as it continues to deepen its presence both domestically and overseas.",https://www.businessoffashion.com/news/beauty/nykaa-appoints-global-ambassador-deepika-padukone/,,2025-09-26T11:52:36.223125+00:00,https://img.businessoffashion.com/resizer/v2/O2SYF2G7CBBUVC2J5CXBYCNABI.jpg?auth=656a39f7e7fe1853fc5f733d27d420e4b8316a19c743bc3fa36f22f0bddb9add&smart=true&width=2000&height=1349
Rolex Faces Questions Over Trump US Open Invitation Amid Tariffs Pain,US Senator Elizabeth Warren asked the Swiss watchmaker’s CEO in a letter if Rolex was seeking to ‘curry favor’ with Trump in order to secure special-interest duty exemptions for its products.,https://www.businessoffashion.com/news/luxury/rolex-faces-questions-over-trump-us-open-invitation-amid-tariffs-pain/,,2025-09-26T11:52:36.223167+00:00,https://img.businessoffashion.com/resizer/v2/CGVU7PKIFFBLZP6UZJZTWY73JA.png?auth=2b97f87ebea554067f5715cc21f80884ae95230ad1927814dd0207f880982fb0&smart=true&width=1800&height=1013
Britain’s JD Sports Says Nike ‘Doing All the Right Things’ to Lift Sales,Nike products comprise roughly 45 percent of JD Sports' sales.,https://www.businessoffashion.com/news/sports/britains-jd-sports-says-nike-doing-all-the-right-things-to-lift-sales/,thing,2025-09-26T11:52:36.223208+00:00,https://img.businessoffashion.com/resizer/v2/TO7KJLFZEJDGPKJVBDZBZVHKCM.jpg?auth=ada5187ab3224b498bf45ab5d3d632540a4cd31449c866360f4c6d3ef756daaa&smart=true&width=1800&height=1013
Ssense Founders Join Sale Process for Troubled Retailer,"Rami Atallah, chief executive of the embattled e-tailer, told employees on Sep. 17 that the company is set to be sold in early October, and announced a new round of layoffs.",https://www.businessoffashion.com/articles/retail/ssense-founders-say-company-is-up-for-sale/,"new, announced",2025-09-26T11:52:36.223242+00:00,https://img.businessoffashion.com/resizer/v2/3JATNAFA5JF3HJC6T6BZHVE2EI.jpg?auth=e0e73718b5c185482c8d45dd193c9ad2706746d838060e74beb325aa833f72f7&smart=true&width=1800&height=1012
Italy’s Supply Chain Scandals Percolate in Background at Milan Fashion Week,Max Mara’s Maramotti says solutions are on the way for a problem that has dogged Italy’s fashion industry.,https://www.businessoffashion.com/news/luxury/italys-supply-chain-scandals-percolate-in-background-at-milan-fashion-week/,fashion,2025-09-26T11:52:36.223280+00:00,https://img.businessoffashion.com/resizer/v2/CRAP5GSLDNGUNAPNOXB7IBNF44.png?auth=3c0a9cf79dffb0043852821e0f452967074c01ddd514b2829343a40576b0125f&smart=true&width=1800&height=1013
Stone Island’s CEO Details New Store Design and Expansion Plans,"The luxury Italian sportswear label is revamping stores in key US cities, as it looks to return to growth.",https://www.businessoffashion.com/articles/retail/stone-island-new-york-city-flagship-reopening/,new,2025-09-26T11:52:36.223318+00:00,https://img.businessoffashion.com/resizer/v2/W4GS32JOFNB23NTQUXTZHY6OTM.jpg?auth=c8b1fd5d6ae7e83e5bf6162c0061f198db1d50b723a3bedd1779f0e9404f6b1c&smart=true&width=1800&height=1013
Deported Makeup Artist Andry Hernández Romero’s American Nightmare,"He came to the US with a dream of a beauty career free of persecution. Instead, Andry Hernández Romero disappeared for months into one of the world's worst prisons. Now, he's rebuilding his life from scratch.",https://www.businessoffashion.com/articles/beauty/deported-makeup-artist-andry-hernandez-romeros-american-nightmare/,,2025-09-26T11:52:36.223355+00:00,https://img.businessoffashion.com/resizer/v2/C6RU5IYK4VDTBG6D5RTTHFLEYE.png?auth=8cc014c06ec4ebec694dd803397f4dc6be648d8d09c493c20e8851e724185403&smart=true&width=1800&height=1013
Milan Day Two: Minimalism Vs. Maximalism,"If Simone Bellotti’s debut was faithful to Jil Sander, restraint was never an option at Fendi, setting up a day of stark contrasts at Milan Fashion Week, writes Angelo Flaccavento.",https://www.businessoffashion.com/reviews/fashion-week/milan-day-two-minimalism-vs-maximalism/,"minimalism, fashion",2025-09-26T11:52:36.223399+00:00,https://img.businessoffashion.com/resizer/v2/YLMYOGEUIVGQDIUO3WSYQNERGU.jpg?auth=a8451ddd94f230cc4e13113ac36eaba25d710307ef424e5aeead3fa2a2ed8ab8&smart=true&width=4088&height=2298
The Debrief | Gen Z Isn’t Buying Luxury’s Story,"Prices are up, hype is out and vintage is in. BoF correspondents Lei Takanashi and Jessica Kwon join The Debrief to explain why Gen Z is drifting away from luxury — and how brands can win them back.",https://www.businessoffashion.com/podcasts/luxury/the-debrief-gen-z-isnt-buying-luxurys-story/,vintage,2025-09-26T11:52:36.223442+00:00,https://img.businessoffashion.com/resizer/v2/O62YJJJXHRDKVEQFLXFXB5N7T4.png?auth=00ee8ae62fff81250b72e0b718003f533dac6be067e8abaa446c0a332d8fe665&smart=true&width=1920&height=1080
"Custom Fragrance Maker Olfactory NYC Expands to Texas, Charts US Expansion","The personalised perfumery will open a store in Dallas’ upmarket West Village neighbourhood on Oct. 24, its ninth retail location, with more US openings slated to follow.",https://www.businessoffashion.com/articles/beauty/olfactory-nyc-texas-expansion/,,2025-09-26T11:52:36.223482+00:00,https://img.businessoffashion.com/resizer/v2/ADUT3TA455CFLO4KUXUPU3HAOM.jpg?auth=5453237b5af8ba2ede4244a053806d11f9ca79c6d183a8f331d6d736af3eae1a&smart=true&width=1800&height=1200
Demna and Gucci: Written in the Stars,"A look book and a movie were all it took to propel Gucci back into the fashion conversation. But Demna already has his sights set on a February show inflected with ‘a new minimalism,’ the designer told Tim Blanks in an in-depth interview.",https://www.businessoffashion.com/reviews/fashion-week/demna-and-gucci-written-in-the-stars/,"minimalism, new, fashion, designer",2025-09-26T11:52:36.223524+00:00,https://img.businessoffashion.com/resizer/v2/2W4CBBQUBBAHBLNOPGGGK2TVEM.jpg?auth=fbf829809bf4be43a8a2799a53ce8bc93ce8198b03e95e5d5c4315f80de7f31b&smart=true&width=4444&height=6664
Report: Nestlé To Undergo Strategic Review of Its Vitamin Business,"The food and beverage giant has appointed Morgan Stanley to explore options for its ailing vitamins businesses, sources told Bloomberg.",https://www.businessoffashion.com/news/beauty/nestle-appoint-morgan-stanley-for-strategic-vitamin-review/,,2025-09-26T11:52:36.223567+00:00,https://img.businessoffashion.com/resizer/v2/NWWDFOO45VDS3D62TLAWL53H2I.jpg?auth=a87d0911447b32c78fdb450dcff666258f0d8028426c8984a4768feb71747bc9&smart=true&width=1800&height=1013
Gen Alpha Looks for Its Own Rhode,"Drunk Elephant may be old news for Gen Alpha, but a wave of new brands, including Sincerely Yours and Yes Day, are hoping to capture tweens’ attention at just the right moment.",https://www.businessoffashion.com/articles/beauty/gen-alpha-looks-for-its-own-rhode/,new,2025-09-26T11:52:36.223605+00:00,https://img.businessoffashion.com/resizer/v2/WW2YFPNIM5ACDCCTQOFOACU6QE.jpg?auth=7061b03d22b553837d33dfbd8b86b3bdb2d9339190313517e9e5f2049443a0d3&smart=true&width=1800&height=1013
Dior Bets on Men’s Grooming With Sauvage London Pop-Up,"The LVMH-owned beauty and fashion juggernaut is leaning on its Sauvage franchise, now the number one men’s fragrance in the world, to power a deeper entry into the men’s grooming market.",https://www.businessoffashion.com/news/beauty/dior-fort-sauvage-pop-up-london/,fashion,2025-09-26T11:52:36.223644+00:00,https://img.businessoffashion.com/resizer/v2/FOODIE2GPFHXFNBIHL5QXQY3QI.jpg?auth=520e412be0bfc7fce3195f17b8023666804190eeffbbaee87cea7e8dacb80064&smart=true&width=2000&height=1333
Charlotte Tilbury Launches on Amazon,Amazon’s premium beauty selection continues to expand with the addition of Charlotte Tilbury.,https://www.businessoffashion.com/news/beauty/charlotte-tilbury-launches-on-amazon/,,2025-09-26T11:52:36.223684+00:00,https://img.businessoffashion.com/resizer/v2/ANJDST7L7NCXVFW6QBVJ2UF5L4.jpg?auth=c505fb78ed12a1361ce61819a814be09698d7426743eae0287169fd6cd972a86&smart=true&width=1800&height=1013
Tech Mode: What Will Become of TikTok’s Algorithm?,"The video-sharing app — and one of fashion’s favourite marketing channels — may soon have new owners, while Meta and Ray-Ban reveal their new high-tech glasses and more brands turn to AI for marketing.",https://www.businessoffashion.com/briefings/technology/tech-mode-what-will-become-of-tiktoks-algorithm/,"new, fashion",2025-09-26T11:52:36.223720+00:00,https://img.businessoffashion.com/resizer/v2/T7S2U2VWYVE23HFPVIOZIYZZZA.jpg?auth=725f6fde0fb39f47ee8a80d8365eead582c3c330af6627fb4b68d31704d840b4&smart=true&width=1800&height=1013
Beauty Manufacturer Intercos Targets Deals to Expand in US,"The Italian cosmetics producer is looking to acquire a US-based skincare and hair care company, according to chief executive Renato Semerari.",https://www.businessoffashion.com/articles/beauty/beauty-manufacturer-intercos-targets-deals-to-expand-in-us/,,2025-09-26T11:52:36.223761+00:00,https://img.businessoffashion.com/resizer/v2/S7VXCBSWONFN5LQNHGDEP2OH6U.jpg?auth=11ccf116baae90203b0ce6071fde2813a2180cc5395aeb97a02b4add9edbf858&smart=true&width=1800&height=1013
Milan Day One: How to Revamp a Brand,"Gucci’s Demna and Diesel’s Glenn Martens — one beginning a brand reinvention, one already knee-deep — both hatched something new on the first day of Milan Fashion Week.",https://www.businessoffashion.com/reviews/fashion-week/milan-day-one-how-to-revamp-a-brand/,"new, thing, fashion",2025-09-26T11:52:36.223800+00:00,https://img.businessoffashion.com/resizer/v2/IP3FKWJGRJHJPEUWH5YFNS2MOE.jpg?auth=12f1d696d16ace92e8f213726271f4a7a9e098070015056d4c078926e5376b53&smart=true&width=2952&height=1660
Innovent Biologics Challenges Novo and Lilly in China’s GLP-1 Market,"Innovent’s drug Xinermei, also known as mazdutide, is the third most popular weight loss treatment in the country behind Wegovy and Mounjaro and steadily gaining share.",https://www.businessoffashion.com/news/beauty/innovent-challenges-novo-lilly-in-chinese-weight-loss-market/,,2025-09-26T11:52:36.223839+00:00,https://img.businessoffashion.com/resizer/v2/PNTJ4RKFVJAV5H5CFTEBGRBSIY.jpeg?auth=d04edb91fecc5a05b7c12339826d940634a163448eb121126d33eabd0c97138c&smart=true&width=2092&height=1393
