title,summary,link,matched_keywords,ingested_at,image_url
AI passed the hardest CFA test in minutes,"Becoming a chartered financial analyst (CFA)—a certification that requires thousands of hours of professional experience, as well as taking a very rigorous exam;  Investopedia calls  it “one of the most respected designations in finance”—is no easy feat.  That is, until now . 
 Two years ago,  AI  models could only pass the first two sections of the prestigious, three-part exam. The essay section, however, had it stumped.  
 And yet,  in a new study  from New York University’s Stern School of Business and GoodFin, an AI-powered wealth management platform, advanced AI like Gemini 2.5 Pro and Claude Opus passed the exam with flying colors. What would’ve taken a human  1,000  hours of studying over multiple years took AI a matter of minutes.  Just two years ago , analysts were saying that it would never be able to pass the exam. It’s a sign of how advanced the technology has become, and once again fuels discussion about how AI could replace even the most challenging jobs. 
 But Anna Joo Fee, founder and CEO of GoodFin, which contributed to the research but did not fund it,  told CNBC , “There are things like context and intent that are hard for the machine to assess right now. That’s where a human shines, in understanding your body language and cues.” 
 That didn’t stop social media from having all sorts of reactions. 
 One LinkedIn user called the news both an “impressive milestone” and “a little eye opening.” They  wrote  in a comment: “It doesn’t replace the human side of financial advising, but it does raise big questions about how the role of advisors and analysts will evolve in the near future.”  
 “AI passing the CFA in minutes while humans cry over flashcards for years? At this point, the calculator deserves a corner office,”  another  joked. 
 On the  r/CFA  subreddit, however, many were actually unimpressed. “Isn’t that like taking an open book exam? Unless your AI has memory problems,” one wrote. “Study: ‘water is wet’.” 
 While it may not be surprising to some, the study does make plain the rapid pace of change in AI’s capabilities in just a few short years.  
 “Right now, most of the conversation about work is about chasing the latest signal of what AI can do at work. It’s a messy, noisy, often contradictory conversation because AI is change that keeps changing,” chief economic opportunity officer at LinkedIn, Aneesh Raman,  wrote  in a post.  
 He encouraged: “This new era is about the mind not the machine. Focus on the mind—yours, your teams, your organizations, your societies—and so many opportunities will unfold in the coming years. It’s not the robots that are coming. The humans are coming!” 
 A finance professional at PwC agreed. “AI won’t replace finance professionals—but finance professionals using AI will replace those who don’t,”  she wrote . Her advice is to be selective about the tools you adopt, prioritize use cases, and prepare to “work alongside AI.” 
 For now, though, this most recent headline is yet more fearmongering about the arrival of an omniscient entity plucking jobs from under our feet and kicking entire industries to the curb. 
 “It’s just another test a machine can pass faster, cheaper, and without breaking a sweat.  Let’s be real. This is bigger than finance,”  another LinkedIn user wrote . “This is a warning shot for every ‘thinking’ job we thought was future-proof.”",https://www.fastcompany.com/91411134/ai-passed-the-hardest-cfa-test-in-minutes,"lace, matte, technology, new, color, big, thing, future, latest",2025-09-26T11:52:43.078701+00:00,"https://images.fastcompany.com/image/upload/w_1280,q_auto,f_auto,fl_lossy/f_webp,q_auto,c_fit/wp-cms-2/2025/09/p-1-91411134-ai-passed-the-hardest-cfa-test-in-minutes.jpg"
"Here’s how Bryson DeChambeau, golf’s mad scientist, is using AI as a swing coach","Artificial intelligence is infiltrating every corner of professional sports, from  scouting  and injury prevention to scheduling. Now, it looks like golf has its most sophisticated  AI  adoption yet, and it’s happening in the bag of Bryson DeChambeau, the sport’s  most notorious tinkerer .  
 “We’re building an AI golf coach,” DeChambeau says. “Essentially, it will be a golf coach that, based on data, will be able to tell you exactly what you’re doing, how to practice, and how to improve your game. We can take a golf swing, compile the information, upload it, and within a minute, it will give me what’s different from my gold standard set of swings.” 
 
 The setup is deceptively simple: a smartphone on a tripod gathering data via video, paired with Google’s  Gemini AI  to interpret said data. Combined, they create a swing coach so intuitive that DeChambeau uses it even moments before teeing off in a tournament. 
 “The mental game is something I’ve always struggled with,” he says. “But whenever I become a little more confident and comfortable with my feel, my mental game goes extremely positive. And this assistant has helped me become a lot more confident with my golf swing.” 
 AI + AI = Coach 
 DeChambeau’s coaching system starts with  SportsBox , an AI-powered 3D biomechanical analysis app that analyzes over 30 key points on the body, club, and ball per golf swing. It measures everything from rotational range of motion to kinematic sequencing—the precise order in which different body parts accelerate and decelerate through the swing. This data is then processed by Gemini AI to turn those measurements into actionable coaching insights. 
 Think of SportsBox as the measuring tool, Gemini as the AI coach agent, and  Google Cloud  as the platform hosting it all. 
 The system starts by building and maintaining a database of DeChambeau’s optimal swings from recent years to create his “gold standard” set. So, when he hits a poor shot, the AI immediately measures that shot against his gold standard set and ranks the factors most likely contributing to the miss. 
 “We can take a golf swing, then upload it, and within a minute, it will give me what’s different from my gold standard set of swings,” he says. “It will give me a rundown list of the top [deviations] that are correlating to whatever’s causing me to miss.” 
 According to Granville Valentine, managing director of AI go-to-market at Google Cloud, it’s Gemini’s multimodal capabilities that bring the SportsBox data to life, creating the interactive coaching agent. 
 “Gemini is very differentiated on multimodality—the ability to ingest the combination of video, audio, text, and voice, and even livestreaming some of those capabilities into the model,” he says. “The combination of really deep video understanding plus core reasoning comes out in differentiated coaching guidance.” 
 The devil’s in the details 
 The granular nature of DeChambeau’s AI coaching reveals just how sophisticated modern sports analytics has become. The system uses Z-scores—statistical measurements showing how many standard deviations a movement is from the mean of a data set—to identify exactly where problems occur. Previously, DeChambeau would capture swing data but wait hours or days for analysis. With this technology, he gets feedback within a minute, allowing for real-time adjustments before a round. 
 “We were going through [the data] by hand in an Excel spreadsheet,” he says. “It was a manual process, very difficult. So you’re talking about months and months of trying to study the golf swing, now done in minutes.” 
 The data is also surprisingly precise. “Let’s say it’s a radial deviation at P6,” DeChambeau says. “That’s too much, meaning I’ve got too much wrist hinge, which makes the club come more outside in. So it’s very specific.” 
 For us non-DeChambeaus who got lost at “radial deviation” and checked out at “P6,” that’s where Gemini comes to the rescue. The AI’s ability to adapt its communication style allows users to train it to explain complex biomechanical concepts in terms appropriate for any skill level. Like other large language models, you can ask it questions, such as what specific terms mean, and as your understanding grows, it will adapt to give you more granular, technical data, meeting each golfer where he or she is at. 
 Old dog, new tricks 
 When he began using this technology earlier this year, DeChambeau found one of his fundamental beliefs about his swing challenged. For years, he says, he thought he needed to stay more centered over the ball—more on top of it—when hitting his driver. The AI consistently told him otherwise, saying he was  too  on top of the ball. 
 “It told me to keep swaying my chest just a bit back on the backstroke to get my center mass more  behind  the golf ball so I can allow the club to release through the impact more,” he says. “So that just blew my mind at how precise this assistant is. It was kind of a kick-in-the-butt moment of, wait, you gotta start trusting this thing.” 
 Eventually, he realized the AI’s objectivity as its strength. 
 “It’s unbiased,” he says. “It doesn’t tell you what it  thinks  you should do. It’s literally based on what you do when you’re doing your best, and keeps you in check with that.” 
 Democratizing elite-level instruction 
 The rapid evolution of AI coaching technology suggests we’re witnessing the early stages of a broader transformation in sports training. Valentine points to each new release of Gemini, which shows consistent step-function improvements in spatial awareness and reasoning capabilities. 
 “With each subsequent release, breakthroughs are happening,” he says, comparing Gemini’s current moment to the early days of Waymo self-driving cars, which needed time to become trustworthy enough for widespread adoption. “That level of trust—that level of breakthrough in the model itself—is now kicking over to a place where humans have the confidence to rely on this as a coach relative to a human coach.” 
 Still, Valentine says, the ultimate goal is not to replace human coaches, but to democratize access to elite-level instruction. 
 “I don’t think the objective is to get rid of coaches,” he says. “I think it’s to deliver access to those folks who don’t have access to coaches. There are lots of folks in the world who would probably be very well served to have access to coaching, it just hasn’t been available to them.” 
 At the PGA Tour level, DeChambeau believes there are further use cases for the tool, and that widespread adoption is inevitable once other players experience the results he’s seen. 
 “When these [other golfers] see what the capabilities are, they’ll immediately latch onto it,” he says. “Because it’s not about some theoretical idea. It’s about what works best for them as an individual. I can’t wait for a day when it’s a full-on coach, club fitter, you name it. We’re just at the beginning.”",https://www.fastcompany.com/91410129/how-bryson-dechambeau-is-using-ai-to-fix-his-golf-swing,"lace, fur, technology, new, thing, style",2025-09-26T11:52:43.079735+00:00,"https://images.fastcompany.com/image/upload/w_1280,q_auto,f_auto,fl_lossy/f_webp,q_auto,c_fit/wp-cms-2/2025/09/p-1-1410129-how-bryson-dechambeau-is-using-ai-to-fix-his-golf-swing.jpg"
How Mercy Corps CEO Tjada D’Oyen McKenna is leading her aid org in the face of Trump’s cuts,"Following the Trump administration’s cuts to foreign aid, two-thirds of Mercy Corps’ U.S.-funded programs have been rescinded. CEO Tjada D’Oyen McKenna shares how she’s leading her team amid immense pressure—scrambling to find new ways to help those in need, even as she resorts to layoffs to keep the business afloat. McKenna reveals what she’s hearing from her team of aid workers on the ground in Gaza, and why she isn’t running away from burnout but embracing it. Like many business leaders experiencing political or economic volatility right now, McKenna is faced with a complex conundrum: fight, flight, or freeze. 
 This is an abridged transcript of an interview from   Rapid Response , hosted by the former editor-in-chief of  Fast Company  Bob Safian. From the team behind the  Masters of Scale  podcast,  Rapid Response  features candid conversations with today’s top business leaders navigating real-time challenges. Subscribe to  Rapid Response  wherever you get your podcasts to ensure you never miss an episode. 
 U.S. government funding accounted for half of your funding, right? 
 Exactly. 
 About two thirds of your programs were rescinded. I mean, it’s like an existential crisis, a true existential crisis for the organization. So what did you do? I mean, you faced a slew of urgent decisions. 
 They were urgent decisions, and I have to say it was very clumsy, right? Usually when you work with the government, there are definitions for every single thing, so very specific definition for stop or very specific definition for freeze. And in this case, the guidance wasn’t there. When they said we had to stop doing everything, our first concern was safety for people. If I have people in a remote area of a country or in charge of delivering food to a school feeding program next day, that community didn’t understand that we weren’t showing up the next day, and they certainly didn’t understand it was because the U.S. government told us not to, but we had to go to work. 
 Once it was clear what was going to be cut or what wasn’t going to be cut, we had to go about shutting down those programs across 40 different countries, lots of different labor laws to that. We consolidated some of our regions, we closed some country offices. We just got to work to say, “If the funding wasn’t there for that program, we’ll shut it down in the most responsible way possible and we’ll keep moving and then address what we have to do with the U.S. government to see what we can preserve, make sure our other funders are okay, and still be prepared in case if another hurricane or earthquake had hit during that period, we still had to be prepared to respond.” 
 I mean, the irony is your organization is all about responding to crisis when it emerges and now the crisis becomes you. And in some ways in some of these communities you’re sort of creating the crisis because they’ve become used to having you there. 
 Yes, yes, yes. And I worried a lot about staff safety, particularly in remote places where we were a source of survival for people where we provided access to food, and that continued to plague me. We’d hear reports from colleagues of government officials trying to stop their country director to make sure everyone got paid before they left. And my staff in Sudan, almost all of them are displaced from their homes themselves. So they’re working for us in temporary shelters, still going through the same problems that everyone else is going through. 
 And so this was a weird situation where our organization was the one that had to be the emergency patient, but we also knew . . . You almost felt guilty for feeling bad because people have it so much worse than you do. There were a lot of weird mental gymnastics that were happening for all of us. 
 We’re now months in, past that initial shock. How much do you look at 2025 today as an inflection point, sort of a new normal for USAID orgs like Mercy Corps? Are you kind of holding your breath in a way in hopes that, “A next administration maybe will reinstate things?” 
 No, we know nothing’s going back to the way it was, but we don’t know exactly what that looks like going forward. The other thing that was surreal is there was this demonization of aid or demonization of aid agencies. A lot of misinformation about the work we were doing and how we were doing it. And then there’s the third and fourth effect. So in a lot of places, we rely on UN airplanes to get in and out of certain areas, and so a lot of UN organizations we’re also facing the same U.S. cuts that we were. So we are still digging out of the aftermath. We know the world is fundamentally changed, and right now we are trying to embrace that and move into the future while also knowing the future’s still quite uncertain. 
  I have to ask you about Gaza. There are all the reports about famine in Gaza where you’ve had teams on the ground. Your Mideast director was on this show in October of 2023 soon after Hamas’s October 7th attack as the initial Israeli military action was underway. Are your teams still active on the ground there now? What are they seeing and what might our listeners be missing in the news reports that they’re getting? 
 We have about 35 staff that are still on the ground living and working in Gaza. We’ve had about 1,300 trucks stuck at a border that have not been able to get in. We’ve had some food in those trucks expire in that time period. And even without those trucks, our teams on the ground we’re working with water desalination plants and supplying clean water to people. It’s so dire right now. Our own team members are hungry. They are worried about where their next meal is coming from. We have a staff member that is able to go in and out, and she talks about the weight loss that she’s seen in her colleagues. About a million people are under evacuation orders in Gaza City. A lot of them, this is the fourth, fifth time they’ve moved. 
 And what’s different lately, which really concerns us, is that sense of hope is really eroded. I think people feel like they’ve been just left. This is as tough as it’s ever been, and our own staff are fighting for their own survival. We talk about the lack of food, but 95% of households there just don’t have enough water. And so someone said, “A choice you’re making every day is, do I wash my hands? Do I drink a glass of water? Do I bathe the kids? The little water I have, what do I do with it?” And we just can’t imagine. It’s just been horrific and to feel so powerless, especially when we know there are trucks waiting across the border that could get in. 
 There are people like us that are really eager to do the work, like my staff who are looking for food themselves, who want to get out and do things, and we just know it’s political will that’s stopping that. 
 I spoke to another humanitarian aid leader recently off the record, who shared that starting years ago, they chose not to provide services in Gaza because they were worried and believed that Hamas would inevitably infiltrate their efforts. And obviously this is what the Israeli government or military at least is kind of saying, did you have worries about that? Does that matter when you’re trying to just feed people? 
 Gaza has always been one of the most difficult places in the world to work. I mean, we all are under U.S. anti-terrorism laws. Our staff are vetted. We check the names, we check the lists because the risk of having a staff member be a part of Hamas is too great to bear. We have not seen mass aid diversion from Hamas. That just has not been our experience, and most of our colleagues have not experienced that either. So that has been talked about as a threat. You do see looting, you do see hungry people, crowds of hungry people swarming to every truck and you see children and people throwing themselves in front of trucks. The way to address people stealing aid or making food valuable is to flood the zone with food, and then it’s not as valuable. 
 I think more importantly, there have been anonymous Israeli defense forces in COGAT, which is the border authority officials saying that they’ve seen no mass aid diversion. U.S. government reports, internal former USAID audit reports said they have no evidence of mass diversion of aid. So we work in difficult environments and we all take vetting very seriously, but we know how to do this. We know how to work in these environments.",https://www.fastcompany.com/91411068/how-mercy-corps-ceo-tjada-doyen-mckenna-is-leading-her-aid-org-in-the-face-of-trumps-cuts,"lace, matte, new, next, thing, future",2025-09-26T11:52:43.080625+00:00,"https://images.fastcompany.com/image/upload/w_1280,q_auto,f_auto,fl_lossy/f_webp,q_auto,c_fit/wp-cms-2/2025/09/p-1-91411068-how-mercy-corps-ceo-tjada-doyen-mckenna-is-leading-her-aid-org-in-the-face-of-trumps-cuts.jpg"
Why the Sunday Scaries hit harder when you’re a parent,"It’s Sunday night. Before kids, this was the time to nurse a mimosa hangover and zone out to  The Sopranos . Now? It’s a very different playbook. Sunday evenings feel less like a gentle exhale from the weekend and more like staging a Broadway play with a cast that hasn’t rehearsed and refuses to put on pants. You are simultaneously the chef, chauffeur, hairdresser, homework coach, and emotional support animal. 
 For parents, the Sunday Scaries don’t whisper “your inbox is waiting.” They shout: 
 
 Did you wash the soccer uniform? 
 Are there enough snacks for afterschool? 
 Is the social studies project due tomorrow or Wednesday? 
 Ugh! Did I RSVP for that birthday party? 
 
 The stress creeps up way before the Monday morning alarm. Workweek Ericka already has 15 Google Meets scheduled, but Mom Ericka must also make sure small humans leave the house with a full water bottle, completed homework, and hair appears combed. And unlike our carefree twenties, we can’t just order Pad Thai at 10 p.m. and call it dinner for two days. 
 The case for Sunday systems 
 Here’s the encouraging news: you don’t have to live in perpetual scramble mode. Research consistently shows that people who plan and structure their weeks report lower stress and greater well-being. 
 
 Weekly planning reduces rumination.  In a field experiment, people who sketched out their week in advance reported fewer 2 a.m. spirals about forgotten tasks and felt more engaged during the day. 
 Routines stabilize mental health.  Psychologists link chaotic home routines to worse parental well-being, especially during school transitions. 
 Planning boosts control.  Other studies show that planning is correlated with a greater sense of progress and competence—the feeling that you’re steering the ship instead of clinging to the side in rough seas. 
 
 Of course, let’s be clear: folding laundry does not spark joy. It’s possible that people who are naturally calmer are also more inclined to plan. But the evidence leans in a direction every parent instinctively knows: structure is sanity. 
 How to survive (without spiraling) 
 The trick isn’t to banish the Sunday Scaries—you won’t, unless you invent a time machine or outsource your children. The goal is to outmaneuver them with rituals that make Monday feel less like an ambush. 
 Hold a Family Staff Meeting Yes, it sounds corporate but it works. Ten minutes where everyone lays out the week: who needs poster board, who has soccer practice, who’s on snack duty. Cookies as bribes are encouraged. 
 Do Laundry Like It’s Gospel Uniforms, tights, hoodies, and beloved blankies must be washed and folded by 7 p.m. Otherwise, you’ll discover the only clean option is a Halloween cape on Wednesday morning. 
 Play Fridge Tetris Stock the fridge like a level of  Tetris : cheese sticks where you can grab them, sandwich fixings prepped, carrots visible so you can feel virtuous (even if no one eats them). 
 With a system in place, you can turn Sunday night from a slow-motion panic spiral into something approaching serenity. Because Monday morning will still bring tears over the wrong-colored water bottle, but if the bags are packed, the laundry is folded, and the fridge is stocked, you will survive with a little more calm, and maybe even brushed hair.",https://www.fastcompany.com/91408088/why-sunday-scaries-hit-harder-when-youre-a-parent,"lace, new, color, thing",2025-09-26T11:52:43.081444+00:00,"https://images.fastcompany.com/image/upload/w_1280,q_auto,f_auto,fl_lossy/f_webp,q_auto,c_fit/wp-cms-2/2025/09/p-2-91408088-why-sunday-scaries-hit-harder-when-youre-a-parent.jpg"
