title,summary,link,matched_keywords,ingested_at,image_url
"Pelli Clarke & Partners ""reshapes the skyline"" with Boston South Station skyscraper","US architecture studio Pelli Clarke & Partners has completed a skyscraper clad in glass on top of a restored 1899 train station in Boston, USA, the ""busiest transit hub in New England"". Boston South Station, an 1899 curved neoclassical structure designed by Boston firm Shepley, Rutan and Coolidge, had had no major upgrades since restoration 
 The post  Pelli Clarke & Partners ""reshapes the skyline"" with Boston South Station skyscraper  appeared first on  Dezeen .",https://www.dezeen.com/2025/09/25/pelli-clarke-partners-boston-south-station-skyscraper/,new,2025-09-26T11:52:41.467240+00:00,
SANAA completes Taichung Green Museumbrary in Taiwan,"Japanese studio SANAA has reached completion on its largest cultural project to date, Taichung Green Museumbrary in Taiwan. Set to open to the public in Taichung's central park in December, the 58,016-square-metre building contains an art museum and a city library, spread across eight blocks interconnected with winding walkways. Taichung Green Museumbrary has been completed 
 The post  SANAA completes Taichung Green Museumbrary in Taiwan  appeared first on  Dezeen .",https://www.dezeen.com/2025/09/25/sanaa-taichung-green-museumbrary/,,2025-09-26T11:52:41.467404+00:00,
Medieval church suspended 14 metres above London skyscraper construction site,"A 700-year-old church tower has been suspended above a construction site during excavation works for the upcoming 50 Fenchurch Street skyscraper in London, designed by architecture studio Eric Parry Architects. Carried out by construction company Multiplex, over 125,000 tonnes of earth were removed from the ground around the Grade I-listed Tower of All Hallows Staining. 
 The post  Medieval church suspended 14 metres above London skyscraper construction site  appeared first on  Dezeen .",https://www.dezeen.com/2025/09/25/church-tower-london-50-fenchurch-street-construction/,,2025-09-26T11:52:41.467547+00:00,
"Biodesign adds ""a whole new range of possibilities"" to fashion says Iris van Herpen","Making clothes using living organisms is fundamentally changing how Iris van Herpen thinks about materials, the Dutch fashion designer tells Dezeen in this interview. Since starting her own studio 18 years ago, Van Herpen has carved out a reputation for sculptural designs that are innovative even for the inherently experimental world of couture fashion. One 
 The post  Biodesign adds ""a whole new range of possibilities"" to fashion says Iris van Herpen  appeared first on  Dezeen .",https://www.dezeen.com/2025/09/25/biodesign-fashion-iris-van-herpen-interview/,"new, material, fashion, designer",2025-09-26T11:52:41.467684+00:00,
Swivel chairs by Vipp,"Dezeen Showroom: Danish homeware brand Vipp has added to its family of Swivel chairs, which have a classic modernist aesthetic that combines aluminium and leather. The Swivel series balances timeless design and everyday functionality, according to Vipp, with compact and visually lightweight silhouettes that sit as easily within a home office as a conference room. 
 The post  Swivel chairs by Vipp  appeared first on  Dezeen .",https://www.dezeen.com/2025/09/25/swivel-chairs-vipp-dezeen-showroom/,silhouette,2025-09-26T11:52:41.467825+00:00,
"""The idea of designing for virtual worlds is just getting started""","Rumours of the metaverse's demise are greatly exaggerated – particularly when it comes to designing virtual buildings, writes Sarah Housley. An article about the metaverse? Is it 2020? No futures vision has burned more brightly or been abandoned more quickly this decade than the metaverse. But like all ""failed"" futures, the metaverse has not gone. 
 The post  ""The idea of designing for virtual worlds is just getting started""  appeared first on  Dezeen .",https://www.dezeen.com/2025/09/25/metaverse-sarah-housley-opinion/,future,2025-09-26T11:52:41.467975+00:00,
Sponge city creator Kongjian Yu killed in Brazil plane crash,"Landscape architect Kongjian Yu, the founder of Chinese studio Turenscape, and three others have died in a plane crash in Brazil's Pantanal wetlands while reportedly making a documentary about his sponge city model. A small aircraft crashed in Brazil's Mato Grosso do Sul state on Tuesday as it attempted to land at a farm near 
 The post  Sponge city creator Kongjian Yu killed in Brazil plane crash  appeared first on  Dezeen .",https://www.dezeen.com/2025/09/25/kongjian-yu-sponge-city-plane-crash/,,2025-09-26T11:52:41.468125+00:00,
"Alison and Peter Smithson school to be refurbished ""before it is too late""","Plans have been unveiled by London-based architecture studio Jestico + Whiles to revitalise Alison and Peter Smithson's 1950s Smithdon High School in Norfolk, UK. Completed by the duo in 1954, the Grade II*-listed secondary school, previously named Hunstanton School, comprises two glass and steel structures that both are in need of updating. According to Jestico 
 The post  Alison and Peter Smithson school to be refurbished ""before it is too late""  appeared first on  Dezeen .",https://www.dezeen.com/2025/09/25/smithsons-hunstanton-school-smithdon-refurbishment/,fur,2025-09-26T11:52:41.468270+00:00,
Proposal to revive Kenzo Tange's Kagawa gymnasium wins Radical Renewal Competition,"Architect Ethan Akiyama Poh has won Dezeen and Bentley's Radical Renewal Competition with a concept that reimagines architect Kenzo Tange's disused post-war gymnasium, currently facing demolition, as a thriving civic destination. Akiyama Poh proposed reprogramming Pritzker Architecture Prize-winning architect Tange's Kagawa Prefectural Gymnasium, which is currently unoccupied and threatened with demolition due to seismic and 
 The post  Proposal to revive Kenzo Tange's Kagawa gymnasium wins Radical Renewal Competition  appeared first on  Dezeen .",https://www.dezeen.com/2025/09/25/new-ground-ethan-akiyama-pohradical-renewal-competition-bentley-winner/,new,2025-09-26T11:52:41.468413+00:00,
"Frama designs first international store in Tokyo to ""reflect the architecture of wellbeing""","Design brand Frama has opened its first permanent shop outside of Denmark in Tokyo, Japan, with a tactile, minimalist interior dominated by wood and stone. Located in the Shibuya Parco shopping centre, Frama Tokyo displays the brand's Care collection of fragrances and beauty products on stainless-steel shelves that cover three of its four walls. Walls 
 The post  Frama designs first international store in Tokyo to ""reflect the architecture of wellbeing""  appeared first on  Dezeen .",https://www.dezeen.com/2025/09/25/frama-first-international-store-tokyo-wellbeing/,collection,2025-09-26T11:52:41.468570+00:00,
"Acme Brick helps make dermatologist's office a ""visual playground""","Promotion: the slender Fusion thin bricks by brick manufacturer Acme Brick lend a pearlescent quality to the facades of this office building in Texas, designed by US studio An.onymous. Located in North Richland Hills, the 836-square-metre building was created for dermatologist Northstar Dermatology and is intended as a contemporary take on healthcare architecture. The building's 
 The post  Acme Brick helps make dermatologist's office a ""visual playground""  appeared first on  Dezeen .",https://www.dezeen.com/2025/09/25/acme-brick-fusion-thin/,,2025-09-26T11:52:41.468719+00:00,
Snøhetta completes arched extension to St Louis' Powell Hall,"Architecture studio Snøhetta has completed a sculptural addition to the home of St Louis Symphony Orchestra in St Louis, USA, while revamping historical interiors and creating a public-facing plaza. Snøhetta restored and expanded Powell Hall, adding a series of arched forms that hug the side of the historic building, which was designed in the early 
 The post  Snøhetta completes arched extension to St Louis' Powell Hall  appeared first on  Dezeen .",https://www.dezeen.com/2025/09/24/snohetta-st-louis-powell-hall-extension/,,2025-09-26T11:52:41.468871+00:00,
Blackdot's AI-powered tattoo device promises to make tattoos faster and less painful,"Austin-based startup Blackdot has developed an AI-powered tattoo device it says is faster, safer, and less painful than a human-made tattoo. While it is automatic, the device is not a self-serve tattoo device, nor does it generate the designs itself. First, artists design intricate tattoos like fine patterns or optical illusions. Then, an operator guides 
 The post  Blackdot's AI-powered tattoo device promises to make tattoos faster and less painful  appeared first on  Dezeen .",https://www.dezeen.com/2025/09/24/blackdot-ai-powered-tattoo-device/,,2025-09-26T11:52:41.469022+00:00,
"New design school described as ""laboratory for our global future"" opens to postgraduate students","Promotion: the Uzbekistan Art and Culture Development Foundation has launched the Aral School, a new ecological education programme open to applications until 5 October. Uzbekistan Art and Culture Development Foundation's (ACDF) chairperson and Aral School founder Gayane Umerova described the school's goal as ""tackling crucial global topics that require visionary responses from the next generation 
 The post  New design school described as ""laboratory for our global future"" opens to postgraduate students  appeared first on  Dezeen .",https://www.dezeen.com/2025/09/24/aral-school/,"new, next, future",2025-09-26T11:52:41.469170+00:00,
Five touchable tiles by Marazzi on Dezeen Showroom,"Dezeen Showroom: from intricate tiles to stone-effect surfaces, 2025 has seen Italian manufacturer Marazzi list another handful of its products on Dezeen Showroom. Marazzi's Terramater tiles were designed to pay homage to the aesthetic of vintage ceramics. The collection contains seven glazed colourways, each of which blends with the material's original hue to create richly textured 
 The post  Five touchable tiles by Marazzi on Dezeen Showroom  appeared first on  Dezeen .",https://www.dezeen.com/2025/09/24/tiles-surfaces-slabs-marazzi-dezeen-showroom/,"vintage, material, collection",2025-09-26T11:52:41.469317+00:00,
Julius Nielsen completes tiny 12-sided church in Copenhagen,"Danish architect Julius Nielsen has created a small timber church in Copenhagen, which features a 12-sided hall symbolising the 12 apostles. Located in Copenhagen's North Harbour district, the 75-square-metre building is named Tiny Church Tolvkanten after the Danish word for a dodecagon, or a 12-sided polygon. To emphasise this unusual geometry, Nielsen designed the church 
 The post  Julius Nielsen completes tiny 12-sided church in Copenhagen  appeared first on  Dezeen .",https://www.dezeen.com/2025/09/24/julius-nielsen-tiny-church-tolvkanten/,,2025-09-26T11:52:41.469462+00:00,
What will it take for us to eat lab-grown steak?,"Lab-grown meat is gaining traction. But before we consume it, we need to believe in it – and that's where design comes in. Jane Englefield asks scientists, designers and a food critic what's at stake. ""What is meat, really?"" considered emerging London-based food designer Leyu Li. ""Is it defined by its molecular structure, its nutritional 
 The post  What will it take for us to eat lab-grown steak?  appeared first on  Dezeen .",https://www.dezeen.com/2025/09/24/lab-grown-steak/,designer,2025-09-26T11:52:41.469606+00:00,
Mirroring Dialogue exhibition spotlights design talent from London's African diaspora,"A chaise longue shaped like a pelvic bone and vases made from timber seed pods were among the objects on show in Mirroring Dialogue, a London Design Festival exhibition centred around cultural exchange. The exhibition featured artists, designers and makers ""of the African diaspora and beyond"", to highlight the diversity of creative talents that can 
 The post  Mirroring Dialogue exhibition spotlights design talent from London's African diaspora  appeared first on  Dezeen .",https://www.dezeen.com/2025/09/24/mirroring-dialogue-exhibition-ldf-2025/,designer,2025-09-26T11:52:41.469756+00:00,
"Multitude of Sins designs own material lab as ""spatial memoir"" of salvaged materials","Bengaluru studio Multitude of Sins has used rejected samples, broken prototypes and construction waste to transform an apartment into its material lab and research space. The lab, named Requiem for Ruins, is located in a former residential apartment building on the same floor as the Multitude of Sins studio. This was turned into a material 
 The post  Multitude of Sins designs own material lab as ""spatial memoir"" of salvaged materials  appeared first on  Dezeen .",https://www.dezeen.com/2025/09/24/multitude-of-sins-designs-material-lab-spatial-memoir-salvaged-materials/,material,2025-09-26T11:52:41.469904+00:00,
Proposal to turn warehouse into recycling hub takes second place in Radical Renewal Competition,"Designer Raymond Lapiejko's vision to transform the Hoosac Stores warehouse in Boston into a recycling hub has been awarded second place in Dezeen and Bentley's Radical Renewal Competition. Lapiejko's proposal focused on the Hoosac Stores building in Boston, Massachusetts, a wool storage facility built in 1895 within the Charlestown Navy Yard – an area historically 
 The post  Proposal to turn warehouse into recycling hub takes second place in Radical Renewal Competition  appeared first on  Dezeen .",https://www.dezeen.com/2025/09/24/hoosac-stores-boston-raymond-lapiejko-radical-renewal-competition-bentley/,"lace, new, designer",2025-09-26T11:52:41.470052+00:00,
Designers turn discarded objects into one-off furnishings for Unbroken exhibition,"A rocking horse and a basketball hoop are among the items that designers have reimagined for this London Design Festival exhibition, which includes pieces from 2LG Studio, Pearson Lloyd and more. Unbroken's curator, designer Francesco Feliziani, asked seven fellow creatives to salvage something destined for landfill and transform it into a functional design piece. In 
 The post  Designers turn discarded objects into one-off furnishings for Unbroken exhibition  appeared first on  Dezeen .",https://www.dezeen.com/2025/09/24/unbroken-exhibition-furniture-camden-inspire/,"fur, thing, designer",2025-09-26T11:52:41.470207+00:00,
"Experimental glass brick features at ""long-awaited"" Detroit design exhibition","Demonstrations of a new glass block type and silicone pottery featured at the Detroit Warehouse: Art and Design Fair show during Detroit Month of Design in a post-industrial building. Sited in a Boyer Campbell Building, a former automotive supply building that anchors the Detroit Design District, the exhibition featured work made by local creators. An 
 The post  Experimental glass brick features at ""long-awaited"" Detroit design exhibition  appeared first on  Dezeen .",https://www.dezeen.com/2025/09/23/detroit-warehouse-art-design-fair/,new,2025-09-26T11:52:41.470506+00:00,
"Dezeen Debate features ""humble budget-conscious solution""","The latest edition of our Dezeen Debate newsletter features a renovated 1950s house in Seattle by Best Practice Architecture. Subscribe to Dezeen Debate now. Best Practice Architecture transformed a 1950s house in Seattle's Mt Baker neighbourhood into Lil Shingle, a multigenerational home clad in wooden shingles with a self-contained basement apartment. Readers discussed the conversion, 
 The post  Dezeen Debate features ""humble budget-conscious solution""  appeared first on  Dezeen .",https://www.dezeen.com/2025/09/23/best-practice-architecture-lil-shingle-renovated-1950s-house-seattle-dezeen-debate/,"new, latest",2025-09-26T11:52:41.470656+00:00,
"Pentagram creates logo for Austin based on its ""natural beauty""","Design agency Pentagram has created a new city logo for Austin, Texas, USA composed of green and blue arches representative of the surrounding landscape, which was reportedly leaked early and has drawn criticism. The logo is part of a larger $1.1 million rebranding effort by the city of Austin to establish a consolidated graphic identity 
 The post  Pentagram creates logo for Austin based on its ""natural beauty""  appeared first on  Dezeen .",https://www.dezeen.com/2025/09/23/pentagram-austin-city-logo-redesign-natural-beauty/,new,2025-09-26T11:52:41.470803+00:00,
UFC arena set to be built on White House lawn,"UFC president Dana White has released renderings of a mixed martial arts arena set to be built on the South Lawn of the White House in Washington DC, for the America 250 celebrations in 2026. White revealed the renderings of a massive stage proposed for a UFC fight in 2026 on a Fox News segment 
 The post  UFC arena set to be built on White House lawn  appeared first on  Dezeen .",https://www.dezeen.com/2025/09/23/white-house-ufc-arena/,new,2025-09-26T11:52:41.470943+00:00,
"Barcelona social housing by Cierto Estudio ""challenges traditional gender roles""","Apartments with deliberately non-defined rooms fill this social housing block in Barcelona, which local practice Cierto Estudio has finished with a palette of bold red and pastel green. Named La Comunidad Habitacional, or The Room Community, the block of 51 units is part of the wider Illa Glòries housing development in 22@ – an area of 
 The post  Barcelona social housing by Cierto Estudio ""challenges traditional gender roles""  appeared first on  Dezeen .",https://www.dezeen.com/2025/09/23/la-comunidad-habitacional-cierto-estudio/,,2025-09-26T11:52:41.471096+00:00,
Hugh Broughton Architects set to extend Australian Antarctic research base,"UK studio Hugh Broughton Architects has unveiled its design for a bright yellow addition to the Australian government's research base in Antarctica. Antarctic specialists Hugh Broughton Architects has designed a vehicle workshop as part of a range of upgrades planned for the Davis station in Antarctica. Set to be built from 2026, the workshop was 
 The post  Hugh Broughton Architects set to extend Australian Antarctic research base  appeared first on  Dezeen .",https://www.dezeen.com/2025/09/23/australian-antarctic-research-station-hugh-broughton-architects/,,2025-09-26T11:52:41.471270+00:00,
Foster + Partners arranges Alpine gallery around three-storey car ramp,"British studio Foster + Partners has designed a sinuous timber showroom to mimic the ""contours of the landscape"" in Gstaad, Switzerland. Set to be nestled into a valley, Gstaad House will encompass three floors of gallery and auction space, along with a private members' club on its top floor and a subterranean level. Foster + 
 The post  Foster + Partners arranges Alpine gallery around three-storey car ramp  appeared first on  Dezeen .",https://www.dezeen.com/2025/09/23/foster-partners-gstaad-house-showroom/,,2025-09-26T11:52:41.471411+00:00,
Stainless steel and blue details decorate modular Valley Fair Kiosk for Blue Bottle Coffee,"Japanese studio I IN has created Blue Bottle Coffee's first kiosk in Santa Clara, California, which has a minimalist design and was prefabricated from stainless steel. The aim behind the project was to create a ""design that would clearly express the brand in any location,"" the studio said. Blue Bottle Coffee has stores across Asia 
 The post  Stainless steel and blue details decorate modular Valley Fair Kiosk for Blue Bottle Coffee  appeared first on  Dezeen .",https://www.dezeen.com/2025/09/23/valley-fair-kiosk-i-in-blue-bottle-coffee/,,2025-09-26T11:52:41.471557+00:00,
Pihlmann Architects turns floors into staircases and facades into pavements at Thoravej 29,"Furniture built from doors and stairs made by ""flipping"" concrete floors feature inside this community hub, which architect Søren Pihlmann has created in a 1960s factory and opened up as part of Copenhagen Architecture Biennial. Pihlmann's studio, Pihlmann Architects, won a competition held by commercial art organisation Bikuben Foundation to turn the old factory at 
 The post  Pihlmann Architects turns floors into staircases and facades into pavements at Thoravej 29  appeared first on  Dezeen .",https://www.dezeen.com/2025/09/23/pihlmann-architects-thoravej-29-copenhagen/,fur,2025-09-26T11:52:41.471702+00:00,
Proposal to retrofit Chicago landmark wins third place in the Radical Renewal Competition,"Designer Zixuan Luo has been awarded third place in Dezeen and Bentley's Radical Renewal Competition for her proposal to retrofit Chicago's Richard J Daley Center with passive climate systems while retaining its facade. Called Between Skin and Bone, Luo's proposal focuses on the Richard J Daley Center in downtown Chicago, proposing to retain its facade 
 The post  Proposal to retrofit Chicago landmark wins third place in the Radical Renewal Competition  appeared first on  Dezeen .",https://www.dezeen.com/2025/09/23/between-skin-bone-zixuan-luo-retrofit-chicago-radical-renewal-competition-bentley/,"lace, new, climate, designer",2025-09-26T11:52:41.471848+00:00,
"""The future of EVs is about breaking boundaries"" says Avatr chief design officer","Promotion: the premium electric vehicle (EV) brand Avatr's chief design officer Nader Faghihzadeh has designed the Avatr Vision Xpectra Vision Car to embody his philosophy that design should be ""deeply personal"". Unveiled at the IAA Mobility motor show in Munich last weekend, the four-seater features luxurious details, including a central interaction hub made from glass 
 The post  ""The future of EVs is about breaking boundaries"" says Avatr chief design officer  appeared first on  Dezeen .",https://www.dezeen.com/2025/09/23/avatr-vision-xpectra-car-future-evs-nader-faghihzadeh/,future,2025-09-26T11:52:41.471995+00:00,
"Sylvia Richards combines timber with mirrors for ""supernatural"" effect in New Hampshire","Wood is paired with mirrored panels on the exterior of a research building for biotech company Adimab, which was designed by Sylvia Richards Practice for Architecture to blend with its forested setting and preserve a wetland. Located in Lebanon, New Hampshire, the building is part of the headquarters for Adimab, a biotech company that develops 
 The post  Sylvia Richards combines timber with mirrors for ""supernatural"" effect in New Hampshire  appeared first on  Dezeen .",https://www.dezeen.com/2025/09/22/sylvia-richards-mass-timber-building-biotech-company-new-hampshire/,new,2025-09-26T11:52:41.472141+00:00,
"Politicians reintroduce Democracy in Design Act to ""reflect the diversity"" of US","Two US senators have reintroduced legislation to counter president Donald Trump's traditional architecture mandates for federal buildings, prompting another senator to announce a codification of Trump's mandate. Maryland-based Chris Van Hollen and New Mexico-based Ben Ray Luján, both democrats, recently introduced the Democracy in Design Act (DDA) to the Senate. It mirrors legislation put forward 
 The post  Politicians reintroduce Democracy in Design Act to ""reflect the diversity"" of US  appeared first on  Dezeen .",https://www.dezeen.com/2025/09/22/democracy-in-design-act-counter-usa-trump-architecture/,new,2025-09-26T11:52:41.472287+00:00,
Deconstructed barns become cocooning pavilion at Copenhagen Architecture Biennial,"Weathered wood salvaged from disused farm buildings has been repurposed in Barn Again, a pavilion at Copenhagen Architecture Biennial designed and built by British practice THISS Studio and architectural designer Tom Svilans. Located at Gammel Strand in the Danish capital, the pavilion was built from reclaimed wood from disused barns and landfill sites in Norway, 
 The post  Deconstructed barns become cocooning pavilion at Copenhagen Architecture Biennial  appeared first on  Dezeen .",https://www.dezeen.com/2025/09/22/built-again-pavilion-copenhagen-architecture-biennial/,designer,2025-09-26T11:52:41.472433+00:00,
Our favourite products from London Design Festival 2025,"In the wake of last week's London Design Festival, the Dezeen team has selected their 10 favourite products on show at the city-wide event, including a patchwork timber rocking chair and a lampshade made from old sandpaper. Gem Set by Britney Lee chosen by Jennifer Hahn, design and environment editor ""Figured woods with striking, irregular 
 The post  Our favourite products from London Design Festival 2025  appeared first on  Dezeen .",https://www.dezeen.com/2025/09/22/our-favourite-products-london-design-festival-2025/,patchwork,2025-09-26T11:52:41.472572+00:00,
Norwegian designers use reclaimed materials to customise USM Haller furniture,"Climbing ropes, tall grass and a balloon pump were among the things Norwegian designers used to modify USM Haller's famous modular furniture for an exhibition at Designers' Saturday in Oslo. For USM Haller Re-Framed, Martin A Andersen tasked himself and nine other designers with putting their own twist on the Swiss brand's classic chrome-plated, steel-frame 
 The post  Norwegian designers use reclaimed materials to customise USM Haller furniture  appeared first on  Dezeen .",https://www.dezeen.com/2025/09/22/usm-haller-re-framed-designers-saturday-exhibition/,"fur, material, thing, designer",2025-09-26T11:52:41.472710+00:00,
Grain Pile exhibition in old fire station shows six designers' fresh takes on wooden furniture,"British furniture maker Ercol and Max Radford Gallery commissioned six of the capital's designers to create imaginative chairs, tables, cabinets, and more with timber, at this exhibition for London Design Festival. The six London-based designers – Andu Masebo, Eddie Olin, Joe Armitage, Jaclyn Pappalardo, Isabel Alonso and Lewis Kemmenoe – were all encouraged to craft 
 The post  Grain Pile exhibition in old fire station shows six designers' fresh takes on wooden furniture  appeared first on  Dezeen .",https://www.dezeen.com/2025/09/22/grain-pile-london-design-festival-wood-furniture/,"fur, designer",2025-09-26T11:52:41.472856+00:00,
