title,summary,link,matched_keywords,ingested_at,image_url
Trump Pushes E.U. to Stop Buying Oil and Gas From Russia,"The European Union has sharply reduced its dependence on Russian energy, but it still imports some supplies.",https://www.nytimes.com/2025/09/23/business/trump-russia-natural-gas-europe.html,,2025-09-26T11:52:43.920412+00:00,https://static01.nyt.com/images/2025/09/23/multimedia/23unga-blog-europe-energy-tmbw/23unga-blog-europe-energy-tmbw-mediumSquareAt3X.jpg
Powell Stresses ‘Challenging Situation’ for Fed as Rate Debate Intensifies,"Jerome H. Powell, chair of the Federal Reserve, suggested he saw further scope to lower interest rates this year to protect the labor market despite rising inflation.",https://www.nytimes.com/2025/09/23/business/jerome-powell-federal-reserve-interest-rates.html,fur,2025-09-26T11:52:43.920445+00:00,https://static01.nyt.com/images/2025/09/23/multimedia/23dc-powell-vfcj/23dc-powell-vfcj-mediumSquareAt3X.jpg
Iranian Diplomats Are Barred From Shopping at Costco While Visiting U.S.,"As the U.N. General Assembly met in New York, the Trump administration forbade the Iranian delegation from shopping at discount wholesalers, an apparent bid to inflame Iranian public opinion.",https://www.nytimes.com/2025/09/23/world/middleeast/iran-diplomats-costco-ban-trump.html,new,2025-09-26T11:52:43.920486+00:00,https://static01.nyt.com/images/2025/09/23/multimedia/23xp-iran-costco1-tqjl/23xp-iran-costco1-tqjl-mediumSquareAt3X.jpg
ABC Affiliate Owners Boycott Jimmy Kimmel’s Return to Late Night,"Together, the two TV station groups, Sinclair and Nexstar, control more than 20 percent of ABC’s local affiliates.",https://www.nytimes.com/2025/09/23/business/media/jimmy-kimmel-nexstar-sinclair-boycott.html,,2025-09-26T11:52:43.920525+00:00,https://static01.nyt.com/images/2025/09/23/multimedia/23biz-kimmel-nextstar-plhb-te/23biz-kimmel-nextstar-plhb-mediumSquareAt3X.jpg
What Will Jimmy Kimmel Say Tonight?,"The return of the late-night host’s show raises questions about how the Trump administration, TV affiliate owners and viewers might react.",https://www.nytimes.com/2025/09/23/business/dealbook/jimmy-kimmel-returns-trump.html,,2025-09-26T11:52:43.920563+00:00,https://static01.nyt.com/images/2025/09/23/multimedia/23db-kimmel-vjzk/23db-kimmel-vjzk-mediumSquareAt3X.jpg
Volvo to Build New Hybrid Car to Meet U.S. Demand and Avoid Tariffs,"The Swedish automaker will produce a hybrid model in the state, an effort to meet demand for gas-powered cars and to avoid steep tariffs on imported vehicles.",https://www.nytimes.com/2025/09/23/business/volvo-south-carolina-factory-hybrid.html,new,2025-09-26T11:52:43.920598+00:00,https://static01.nyt.com/images/2025/09/23/business/23biz-volvo/23biz-volvo-mediumSquareAt3X.jpg
Elon Musk’s Father Accused of Child Sexual Abuse,"Errol Musk has been accused of sexually abusing five of his children and stepchildren since 1993, a Times investigation found. Family members had appealed to Elon Musk for help.",https://www.nytimes.com/video/business/100000010404622/elon-musks-father-accused-of-child-sexual-abuse.html,,2025-09-26T11:52:43.920636+00:00,
"Trump’s $100,000 H-1B Visa Fee Puts Many Tech Start-Ups in a Bind","Silicon Valley start-ups said they were concerned they would be disproportionately hurt by the new visa fee for skilled foreign workers, given their limited resources.",https://www.nytimes.com/2025/09/23/technology/trump-h1b-visa-tech-start-ups.html,new,2025-09-26T11:52:43.920700+00:00,https://static01.nyt.com/images/2025/09/22/multimedia/22biz-startup-visas-lgqv/lgqv-mediumSquareAt3X.jpg
"Elon Musk’s Father, Errol Musk, Accused of Child Sexual Abuse","Errol Musk has been accused of sexually abusing five of his children and stepchildren since 1993, a Times investigation found. Family members have appealed to Elon Musk for help.",https://www.nytimes.com/2025/09/23/world/africa/elon-musk-father-errol-child-abuse.html,,2025-09-26T11:52:43.920743+00:00,https://static01.nyt.com/images/2025/08/26/multimedia/00int-muskfamily-safrica-1-tfqb/00int-muskfamily-safrica-1-tfqb-mediumSquareAt3X.jpg
"15 Years Into the Boom, Iceland Asks if It’s Had Enough of Mass Tourism",A volcanic eruption in 2010 put the island nation on millions of travelers’ maps. But is the country’s culture now at risk?,https://www.nytimes.com/2025/09/23/travel/iceland-tourism.html,,2025-09-26T11:52:43.920784+00:00,https://static01.nyt.com/images/2025/09/23/travel/23trav-iceland-1/23trav-iceland-1-mediumSquareAt3X.jpg
Jaguar Faces Prolonged Shutdown After a Cyberattack,The luxury carmaker shut down production in early September to contain the breach. It announced on Tuesday that it would take more time to resume operations.,https://www.nytimes.com/2025/09/23/business/jaguar-land-rover-cyberattack-production.html,announced,2025-09-26T11:52:43.920821+00:00,https://static01.nyt.com/images/2025/09/23/multimedia/23xp-jaguar-cyberattack-qflz/23xp-jaguar-cyberattack-qflz-mediumSquareAt3X.jpg
How Norway Adopted New Tech in Its Hunt for ‘Missing’ Oil,"Going against conventional wisdom, explorers at a Norwegian energy company drilled horizontally to find oil in an abandoned natural gas field.",https://www.nytimes.com/2025/09/23/business/norway-oil-exploration.html,new,2025-09-26T11:52:43.920858+00:00,https://static01.nyt.com/images/2025/09/14/multimedia/Biz-Oil-Norway-01-ftjl/Biz-Oil-Norway-01-ftjl-mediumSquareAt3X.jpg
"As Right-Wing Populism Rises, Progressives Share Tactics in London","Center-left figures including Mark Carney, Keir Starmer, Pete Buttigieg and Jacinda Ardern joined a summit on Friday as their brand of politics appears under threat.",https://www.nytimes.com/2025/09/26/world/europe/progressives-ippr-summit-london-starmer.html,,2025-09-26T11:52:44.009670+00:00,https://static01.nyt.com/images/2025/09/26/multimedia/26int-uk-left-qklh/26int-uk-left-qklh-mediumSquareAt3X.jpg
"As Trump’s H-1B Visa Fee Targets Foreign Workers, China Woos Them",A new visa for science and engineering graduates is part of China’s effort to establish itself as the world leader in science and technology.,https://www.nytimes.com/2025/09/26/world/asia/china-tech-workers-visas-us-h1b.html,"technology, new",2025-09-26T11:52:44.009717+00:00,https://static01.nyt.com/images/2025/09/26/multimedia/26china-stem-visa-jhqz/26china-stem-visa-jhqz-mediumSquareAt3X.jpg
Sarkozy Found Guilty of Conspiracy to Seek Libyan Money and Sentenced to Prison,"Nicolas Sarkozy, former president of France, was found guilty of plotting to finance his 2007 election bid with help from the government of Col. Muammar el-Qaddafi.",https://www.nytimes.com/2025/09/25/world/europe/sarkozy-france-prison-libya-qaddafi.html,,2025-09-26T11:52:44.009777+00:00,https://static01.nyt.com/images/2025/09/25/world/europe/2236908099/2236908099-mediumSquareAt3X.jpg
Denmark Briefly Closes More Airports After Unexplained Drone Sightings,"European governments are on alert after Russian incursions into NATO airspace, but the Danish authorities said they could not say who was behind the latest incidents.",https://www.nytimes.com/2025/09/25/world/europe/drones-denmark-airport.html,latest,2025-09-26T11:52:44.009814+00:00,https://static01.nyt.com/images/2025/09/25/multimedia/25int-denmark-drones-bckt/25int-denmark-drones-bckt-mediumSquareAt3X.jpg
Trump Says He Won’t Allow Israel to Annex the West Bank,"After more countries recognized a Palestinian state this week, President Trump said on Thursday that he would not permit Israel to take over the territory.",https://www.nytimes.com/2025/09/25/world/middleeast/trump-annexation-west-bank.html,,2025-09-26T11:52:44.009848+00:00,https://static01.nyt.com/images/2025/09/25/multimedia/25int-israel-westbank-01-hbfg/25int-israel-westbank-01-hbfg-mediumSquareAt3X.jpg
Kashmir’s Apple Harvest Rots After Landslide Blocks Road,"The Himalayan region supplies most of India’s apples. But when heavy rains left a major highway blocked for weeks, farmers couldn’t get them to markets.",https://www.nytimes.com/2025/09/25/world/asia/india-apples-kashmir-flooding-landslide.html,,2025-09-26T11:52:44.009884+00:00,https://static01.nyt.com/images/2025/09/25/multimedia/25int-india-kashmir-apples-01-fkqh/25int-india-kashmir-apples-01-fkqh-mediumSquareAt3X.jpg
"Israel Attacks Yemeni Capital, a Day After Houthi Drone Strike","The Israeli military said it was targeting sites linked to the Houthi militia, but a witness said a residential building was hit. A day earlier, a Houthi drone hit the Israeli city of Eilat.",https://www.nytimes.com/2025/09/25/world/middleeast/israel-yemen-houthis.html,,2025-09-26T11:52:44.009920+00:00,https://static01.nyt.com/images/2025/09/25/multimedia/25int-yemen-strikes-zvcg/25int-yemen-strikes-zvcg-mediumSquareAt3X.jpg
"Gambians Say, ‘Thank You’ After U.S. Denied Local Officials Visas to Attend U.N. Gathering",Gambians who see officials’ attendance at international events as taxpayer-funded vacations were grateful when some officials were refused U.S. entry for the U.N. General Assembly.,https://www.nytimes.com/2025/09/25/world/africa/gambia-us-visas-un.html,,2025-09-26T11:52:44.009978+00:00,https://static01.nyt.com/images/2025/09/25/multimedia/25int-gambia-un-fzvb/25int-gambia-un-fzvb-mediumSquareAt3X.jpg
This Conquistador Changed History. Neglect Haunts His Tomb in Mexico,"Hernán Cortés toppled the Aztecs, winning Mexico for Spain. His trash-strewn resting place reflects how the conquest is still fueling quarrels and testing ties with Spain.",https://www.nytimes.com/2025/09/24/world/americas/mexico-city-cortes-legacy.html,lace,2025-09-26T11:52:44.010017+00:00,https://static01.nyt.com/images/2025/09/23/multimedia/23int-mexico-cortes-dispatch-PROMO/23int-mexico-cortes-dispatch-01-ghmz-mediumSquareAt3X.jpg
U.S. Threatens to Bar Foreigners Over Remarks About Charlie Kirk,"U.S. officials say they will pull visas and deport people who trivialize Charlie Kirk’s murder, part of intensifying scrutiny of visa applicants’ views.",https://www.nytimes.com/2025/09/24/world/americas/charlie-kirk-visas-speech.html,,2025-09-26T11:52:44.010053+00:00,https://static01.nyt.com/images/2025/09/24/multimedia/24int-visas-kirk-bhmf/24int-visas-kirk-bhmf-mediumSquareAt3X.jpg
Netanyahu Took a Circuitous Route to the U.N. Meeting,"The Israeli prime minister, who is subject to an international arrest warrant for war crimes charges, avoided France and Spain, which have sharply criticized the war in Gaza.",https://www.nytimes.com/2025/09/26/world/middleeast/netanyahu-flight-un-meeting.html,,2025-09-26T11:52:44.010090+00:00,https://static01.nyt.com/images/2025/09/26/multimedia/26unga-blog-netanyahu-flight-1-qvjt/26unga-blog-netanyahu-flight-1-qvjt-mediumSquareAt3X.jpg
Israel’s isolation deepens with a wave of recognitions of Palestinian statehood.,,https://www.nytimes.com/live/2025/09/26/world/un-general-assembly-netanyahu/israels-isolation-deepens-with-a-wave-of-recognitions-of-palestinian-statehood,,2025-09-26T11:52:44.010125+00:00,https://static01.nyt.com/images/2025/09/22/multimedia/22unga-blog-israel-isolation-jzmw/22unga-blog-israel-isolation-jzmw-mediumSquareAt3X.jpg
Netanyahu Addresses the U.N. as Gaza War Nears Two-Year Mark,,https://www.nytimes.com/live/2025/09/26/world/un-general-assembly-netanyahu/heres-what-to-know,,2025-09-26T11:52:44.010152+00:00,
Abbas’s Message to the United Nations,The president of the Palestinian Authority addressed the U.N. General Assembly by video after the U.S. denied him a visa.,https://www.nytimes.com/2025/09/26/briefing/united-nations-trump-comey.html,,2025-09-26T11:52:44.010199+00:00,https://static01.nyt.com/images/2025/09/26/multimedia/26ambriefing-europe-nl/26ambriefing-asia-nl-lede-zhfm-mediumSquareAt3X.jpg
Canada Orders Postal Service to End Door-to-Door Mail Delivery,"The government’s previous attempts at postal service cuts were politically unpopular, but Canada Post’s dire financial situation has expedited them.",https://www.nytimes.com/2025/09/25/world/americas/canada-postal-service-door-mail-delivery.html,,2025-09-26T11:52:44.010232+00:00,https://static01.nyt.com/images/2025/09/25/multimedia/25int-canada-mail-wkhl/25int-canada-mail-wkhl-mediumSquareAt3X.jpg
Kennedy Says U.S. Rejects Global Health Goals,The nation’s top federal health official said the United States could not support W.H.O. policies that he claimed promoted abortion and “radical gender ideology.”,https://www.nytimes.com/2025/09/25/health/rfk-jr-un-chronic-disease.html,,2025-09-26T11:52:44.010268+00:00,https://static01.nyt.com/images/2025/09/25/multimedia/25HS-UNRFK-fvkw/25HS-UNRFK-fvkw-mediumSquareAt3X.jpg
Abbas’s Message on Gaza to the United Nations,The president of the Palestinian Authority addressed the U.N. General Assembly by video after the U.S. denied him a visa.,https://www.nytimes.com/2025/09/25/briefing/abbas-gaza-unga-tiktok-trump-palestine.html,,2025-09-26T11:52:44.010302+00:00,https://static01.nyt.com/images/2025/09/26/multimedia/26ambriefing-asia-nl-lede-zhfm/26ambriefing-asia-nl-lede-zhfm-mediumSquareAt3X.jpg
Microsoft Disables Some Services to Israel’s Defense Ministry,Microsoft said it found that Israel was violating some terms of service for its products and that it does “not provide technology to facilitate mass surveillance of civilians.”,https://www.nytimes.com/2025/09/25/technology/microsoft-israel-defense-ministry.html,technology,2025-09-26T11:52:44.010334+00:00,https://static01.nyt.com/images/2025/09/25/multimedia/Biz-Microsoft-Israel-pwqm/Biz-Microsoft-Israel-pwqm-mediumSquareAt3X.jpg
Abbas Says Hamas Will Not Govern Palestine After War With Israel,"Mahmoud Abbas, the president of the Palestinian Authority, delivered a speech by video to the U.N. General Assembly on Thursday in which he thanked countries for recognizing Palestinian statehood.",https://www.nytimes.com/2025/09/25/world/middleeast/abbas-hamas-gaza-war-unga.html,,2025-09-26T11:52:44.010370+00:00,https://static01.nyt.com/images/2025/09/25/multimedia/25unga-blog-tcwm/25unga-blog-tcwm-mediumSquareAt3X.jpg
4 Strong Earthquakes Strike Venezuela,The quakes and other smaller aftershocks shook cities in Venezuela and Colombia overnight. There were no immediate reports of casualties.,https://www.nytimes.com/2025/09/25/world/americas/venezuela-earthquakes-maracaibo-colombia.html,,2025-09-26T11:52:44.010405+00:00,
Syria’s President Makes His Debut on the World Stage,"In his first U.N. address, Ahmed al-Shara, a former rebel, highlighted his efforts to rebuild Syria and its institutions.",https://www.nytimes.com/2025/09/25/briefing/syria-president-un.html,,2025-09-26T11:52:44.010458+00:00,https://static01.nyt.com/images/2025/09/25/multimedia/25ambriefing-europe-syria-nl/25ambriefing-asia-nl-lede-bghk-mediumSquareAt3X.jpg
U.N. Security Council raises the alarm on the potential dangers of A.I.,,https://www.nytimes.com/live/2025/09/24/world/un-general-assembly-ukraine/un-security-council-raises-the-alarm-on-the-potential-dangers-of-ai,,2025-09-26T11:52:44.010489+00:00,https://static01.nyt.com/images/2025/09/24/multimedia/24unga-blog-artificial-intelligence1-cbtg/24unga-blog-artificial-intelligence1-cbtg-mediumSquareAt3X.jpg
"At the UN, Trump Strikes Radically Different Tones in Public and Private","At the United Nations, world leaders got to see both sides of President Trump: bellicose in public and far more conciliatory in private.",https://www.nytimes.com/2025/09/24/us/politics/trump-united-nations-tones.html,,2025-09-26T11:52:44.010514+00:00,https://static01.nyt.com/images/2025/09/24/multimedia/24dc-Trump-UN-wlhz/24dc-Trump-UN-wlhz-mediumSquareAt3X-v2.jpg
Syria’s President Makes His Debut on the World Stage,"In his first U.N. address, Ahmed al-Shara, a former rebel, highlighted his efforts to rebuild Syria and its institutions.",https://www.nytimes.com/2025/09/24/world/syria-un-ukraine-iran-china-climate.html,,2025-09-26T11:52:44.010545+00:00,https://static01.nyt.com/images/2025/09/25/multimedia/25ambriefing-asia-nl-lede-bghk/25ambriefing-asia-nl-lede-bghk-mediumSquareAt3X.jpg
A Flash of Anger on India’s Delicate Border With China,"Protesters demanding statehood for Ladakh, a strategically important Himalayan region, clashed with the police.",https://www.nytimes.com/2025/09/24/world/asia/ladakh-protests-india.html,,2025-09-26T11:52:44.010572+00:00,https://static01.nyt.com/images/2025/09/24/multimedia/24INT-INDIA-LADAKH-pwcb/24INT-INDIA-LADAKH-pwcb-mediumSquareAt3X.jpg
"With Sobs and Doubts, Greenlandic Women Receive Apology for Forced Contraception","Some Greenlanders asked why an apology had not come decades earlier, and chalked up the timing to tensions over President Trump’s aim of annexing the island.",https://www.nytimes.com/2025/09/24/world/europe/denmark-greenland-apology-birth-control.html,,2025-09-26T11:52:44.010605+00:00,https://static01.nyt.com/images/2025/09/24/multimedia/24int-denmark-apology-01-gckq/24int-denmark-apology-01-gckq-mediumSquareAt3X.jpg
Abdul Gani Bhat Dies at 93; Kashmiri Separatist Championed Dialogue,"Mr. Bhat, a scholar of Persian literature, was a rare and eloquent voice of moderation in Kashmir’s often militant separatist movement.",https://www.nytimes.com/2025/09/24/world/asia/abdul-gani-bhat-kashmir-dead.html,,2025-09-26T11:52:44.010641+00:00,https://static01.nyt.com/images/2025/09/23/world/23int-kashmir-bhat-obit/23int-kashmir-bhat-obit-mediumSquareAt3X.jpg
"Now Arriving, a New Theory of In-Flight Turbulence",Physicists have devised a new model to account for the discomfort that airline passengers know all too well.,https://www.nytimes.com/2025/09/24/science/physics-airplanes-turbulence.html,new,2025-09-26T11:52:44.010673+00:00,https://static01.nyt.com/images/2025/09/30/multimedia/18SCI-TURBULENCE-01-gvjf/18SCI-TURBULENCE-01-gvjf-mediumSquareAt3X.jpg
An Italian City Is Considering a Dog Tax for Tourists and Locals,"If you want to bring your dog to Bolzano, in northern Italy, it may cost you $1.75 per day. For locals, it’s 100 euros a year.",https://www.nytimes.com/2025/09/24/world/europe/bolzano-italy-dog-tax.html,,2025-09-26T11:52:44.010703+00:00,https://static01.nyt.com/images/2025/09/24/multimedia/24xp-dogtax-skwm/24xp-dogtax-skwm-mediumSquareAt3X-v2.jpg
"At U.N. Climate Summit, U.S. Stands Alone","On Wednesday in New York, countries lined up to say they would accelerate their efforts to cut greenhouse-gas emissions. In staying away, the U.S. was all but alone.",https://www.nytimes.com/2025/09/24/climate/united-nations-climate-summit-emissions-targets.html,"new, climate",2025-09-26T11:52:44.010734+00:00,https://static01.nyt.com/images/2025/09/24/climate/24CLI-UNGA-Pledges-01/24CLI-UNGA-Pledges-01-mediumSquareAt3X.jpg
"At U.N. Summit, China Promises to Reduce Greenhouse Gas Emissions","President Xi Jinping told a U.N. climate summit that China will reduce emissions across its economy, expand renewables sixfold and make electric cars “mainstream.”",https://www.nytimes.com/2025/09/24/climate/china-emissions-targets-paris.html,"new, climate",2025-09-26T11:52:44.010766+00:00,https://static01.nyt.com/images/2025/09/22/multimedia/00CLI-ChinaTarget-ktlc/00CLI-ChinaTarget-ktlc-mediumSquareAt3X.jpg
Syria’s leader says his country has transformed from ‘an exporter of crisis.’,,https://www.nytimes.com/live/2025/09/24/world/un-general-assembly-ukraine/syria-president,,2025-09-26T11:52:44.010799+00:00,https://static01.nyt.com/images/2025/09/24/multimedia/24unga-blog-syria-leader-speech-hqfb/24unga-blog-syria-leader-speech-hqfb-mediumSquareAt3X.jpg
"U.N. Health Goals Weakened by Industry Pressure, Experts Say","Public health advocates complained that the final recommendations on combating chronic illness removed calls for taxes on tobacco, alcohol and sweetened drinks.",https://www.nytimes.com/2025/09/24/health/global-health-sugary-drinks-tobacco.html,,2025-09-26T11:52:44.010827+00:00,https://static01.nyt.com/images/2025/09/24/multimedia/24HS-UNFOOD-qzvl/24HS-UNFOOD-qzvl-mediumSquareAt3X.jpg
"Tess Johnston, Diplomat Who Helped Preserve ‘Old Shanghai,’ Dies at 93","She worked in American consulates around the world but found a home in China’s “Paris of the East,” where she documented a vanishing colonial architecture.",https://www.nytimes.com/2025/09/24/world/asia/tess-johnston-dead.html,,2025-09-26T11:52:44.010861+00:00,
"Zelensky Issues Call to Arms, Saying Global Institutions Have Failed","President Volodymyr Zelensky said more weapons were needed to defend his country and the free world, blaming Russia for spurring a dangerous new arms race.",https://www.nytimes.com/2025/09/24/world/europe/unga-zelensky.html,new,2025-09-26T11:52:44.010914+00:00,https://static01.nyt.com/images/2025/09/24/multimedia/24unga-blog-Zelensky-jvht/24unga-blog-Zelensky-jvht-mediumSquareAt3X.jpg
President Ahmed al-Shara Plans to Define Syria’s ‘New State’ at U.N.,"When President Ahmed al-Shara speaks at the United Nations in New York today, he will seek to present an updated picture of his turbulent nation.",https://www.nytimes.com/2025/09/24/world/syria-president-un-general-assembly.html,new,2025-09-26T11:52:44.010947+00:00,https://static01.nyt.com/images/2025/09/22/multimedia/22unga-blog-syria-shara-gzhq/22unga-blog-syria-shara-gzhq-mediumSquareAt3X.jpg
"Small Plane Crashes in Brazil, Killing Chinese Architect","Kongjian Yu, a prominent landscape architect, and three other people were killed when the aircraft crashed in a wetlands region.",https://www.nytimes.com/2025/09/24/world/americas/brazil-plane-crash-architect-kongjian-yu.html,,2025-09-26T11:52:44.010982+00:00,https://static01.nyt.com/images/2024/03/15/multimedia/24int-brazil-crash-2/00cli-spongecities-01-vbwl-mediumSquareAt3X.jpg
"U.K. Endures a Trump Scolding at U.N., Days After Lavish State Visit","President Trump said Europe is “going to hell” and implicitly rebuked Britain on immigration, despite making extended visits to the country and enjoying its hospitality.",https://www.nytimes.com/2025/09/24/world/europe/trump-uk.html,,2025-09-26T11:52:44.011012+00:00,https://static01.nyt.com/images/2025/09/24/multimedia/24int-uk-trump-ktgz/24int-uk-trump-ktgz-mediumSquareAt3X.jpg
Zelensky Warns of Dangerous New Arms Race Tied to Drones,"The Ukrainian leader’s U.N. speech came just a day after President Trump suddenly said Ukraine could win the war with Russia, a change in stance so dramatic it left many Ukrainians wary.",https://www.nytimes.com/2025/09/24/world/europe/trump-war-ukraine-reaction.html,new,2025-09-26T11:52:44.011050+00:00,https://static01.nyt.com/images/2025/09/24/multimedia/24int-ukraine-react-01-qzft/24int-ukraine-react-01-qzft-mediumSquareAt3X.jpg
"Typhoon Ragasa Tears Through a Taiwan Town, Killing 14",Hundreds of firefighters and soldiers dispatched to Guangfu have gone door to door to check for trapped residents.,https://www.nytimes.com/2025/09/24/world/asia/typhoon-ragasa-guangfu-taiwan-photos.html,,2025-09-26T11:52:44.011085+00:00,https://static01.nyt.com/images/2025/09/24/multimedia/24int-typhoon-ragasa-taiwan-08-czmg/24int-typhoon-ragasa-taiwan-08-czmg-mediumSquareAt3X.jpg
"Israeli Strike Kills Gazans Sheltering in Warehouse, Local Reports Say","The Israeli attack in Gaza City killed nearly two dozen Palestinians, the reports said. The Israeli military said it had hit two “Hamas terrorists.”",https://www.nytimes.com/2025/09/24/world/middleeast/israel-strike-gaza-city-civilians.html,,2025-09-26T11:52:44.011114+00:00,https://static01.nyt.com/images/2025/09/24/multimedia/24int-Gaza-Strike-01-mhcb/24int-Gaza-Strike-01-mhcb-mediumSquareAt3X.jpg
London’s Mayor Calls Trump Racist and Islamophobic After U.N. Comments,"Sadiq Khan, the mayor of London, was responding to President Trump’s political attack on him during his speech at the United Nations on Tuesday.",https://www.nytimes.com/2025/09/24/world/europe/london-mayor-trump-comments-sadiq-khan.html,,2025-09-26T11:52:44.011148+00:00,https://static01.nyt.com/images/2025/09/24/world/24int-UK-TRUMP-SADIQ/24int-UK-TRUMP-SADIQ-mediumSquareAt3X.jpg
Iran’s President Arrives at UNGA Seeking to Avoid More Sanctions,"Masoud Pezeshkian addressed the General Assembly looking to prevent the imposition of sanctions on his country, this time from the United Nations Security Council.",https://www.nytimes.com/2025/09/24/world/middleeast/iran-president-un-assembly-sanctions.html,,2025-09-26T11:52:44.011182+00:00,https://static01.nyt.com/images/2025/09/24/multimedia/24unga-blog-iran-setup-topart-jwpz/24unga-blog-iran-setup-topart-jwpz-mediumSquareAt3X.jpg
Here’s the latest.,,https://www.nytimes.com/live/2025/09/24/world/un-general-assembly-ukraine/heres-the-latest,latest,2025-09-26T11:52:44.011214+00:00,
Malawi President Concedes Election to His Predecessor,The concession from President Lazarus Chakwera came despite reports of irregularities at the polls. Final results showed that Peter Mutharika had won nearly 57 percent of the vote.,https://www.nytimes.com/2025/09/24/world/africa/malawi-election.html,,2025-09-26T11:52:44.011251+00:00,https://static01.nyt.com/images/2025/09/24/multimedia/24malawi-election-01-gzjm/24malawi-election-01-gzjm-mediumSquareAt3X.jpg
"Relief, Grief and Pain as Gaza’s Wounded Are Flown to Safety",Hungry and injured passengers on a medical evacuation flight showed the toll of nearly two years of bombardment.,https://www.nytimes.com/2025/09/24/world/middleeast/evacuation-flight-gaza-abu-dhabi.html,,2025-09-26T11:52:44.011301+00:00,https://static01.nyt.com/images/2025/09/22/multimedia/00int-gaza-evac-promo-gvwj/00int-gaza-evac-promo-gvwj-mediumSquareAt3X-v2.jpg
